ID	cell_name	defination	description
CL:0001049	activated CD8-positive, alpha-beta T cell, human	A Recently Activated Cd8-Positive, Alpha-Beta T Cell With The Phenotype Hla-Dra-Positive, Cd38-Positive, Cd69-Positive, Cd62L-Negative, Cd127-Negative, Ccr7-Negative, And Cd25-Positive.	activated CD8-positive, alpha-beta T cell, human A Recently Activated Cd8-Positive, Alpha-Beta T Cell With The Phenotype Hla-Dra-Positive, Cd38-Positive, Cd69-Positive, Cd62L-Negative, Cd127-Negative, Ccr7-Negative, And Cd25-Positive.
CL:0001050	effector CD8-positive, alpha-beta T cell	A Cd8-Positive, Alpha-Beta T Cell With The Phenotype Ccr7-Negative, Cd45Ra-Positive.	effector CD8-positive, alpha-beta T cell A Cd8-Positive, Alpha-Beta T Cell With The Phenotype Ccr7-Negative, Cd45Ra-Positive.
CL:0001051	CD4-positive, CXCR3-negative, CCR6-negative, alpha-beta T cell	A Cd4-Positive, Alpha-Beta T Cell That Has The Phenotype Cxcr3-Negative, Ccr6-Negative.	CD4-positive, CXCR3-negative, CCR6-negative, alpha-beta T cell A Cd4-Positive, Alpha-Beta T Cell That Has The Phenotype Cxcr3-Negative, Ccr6-Negative.
CL:0001052	CD8-positive, CXCR3-negative, CCR6-negative, alpha-beta T cell	A Cd8-Positive, Alpha-Beta T Cell That Has The Phenotype Cxcr3-Negative, Ccr6-Negative.	CD8-positive, CXCR3-negative, CCR6-negative, alpha-beta T cell A Cd8-Positive, Alpha-Beta T Cell That Has The Phenotype Cxcr3-Negative, Ccr6-Negative.
CL:0001053	IgD-negative memory B cell	A Memory B Cell That Lacks Expression Of Surface Igd.	IgD-negative memory B cell A Memory B Cell That Lacks Expression Of Surface Igd.
CL:0001054	CD14-positive monocyte	A Monocyte That Expresses Cd14 And Is Negative For The Lineage Markers Cd3, Cd19, And Cd20.	CD14-positive monocyte A Monocyte That Expresses Cd14 And Is Negative For The Lineage Markers Cd3, Cd19, And Cd20.
CL:0001055	CD14-positive, CD16-low monocyte	An Intermediate Monocyte That Is Cd14-Positive And With Low Amounts Of Cd16.	CD14-positive, CD16-low monocyte An Intermediate Monocyte That Is Cd14-Positive And With Low Amounts Of Cd16.
CL:0001056	dendritic cell, human	A Dendritic Cell With The Phenotype Hla-Dra-Positive.	dendritic cell, human A Dendritic Cell With The Phenotype Hla-Dra-Positive.
CL:0001057	myeloid dendritic cell, human	A Myeloid Dendritic Cell With The Phenotype Hla-Dra-Positive.	myeloid dendritic cell, human A Myeloid Dendritic Cell With The Phenotype Hla-Dra-Positive.
CL:0001058	plasmacytoid dendritic cell, human	A Plasmacytoid Dendritic Cell With The Phenotype Hla-Dra-Positive, Cd123-Positive, And Cd11C-Negative.	plasmacytoid dendritic cell, human A Plasmacytoid Dendritic Cell With The Phenotype Hla-Dra-Positive, Cd123-Positive, And Cd11C-Negative.
CL:0001059	common myeloid progenitor, CD34-positive	A Progenitor Cell Committed To Myeloid Lineage, Including The Megakaryocyte And Erythroid Lineages. These Cells Are Cd34-Positive, And Express Gata1, Gata2, C/Ebpa, And Pu.1.	common myeloid progenitor, CD34-positive A Progenitor Cell Committed To Myeloid Lineage, Including The Megakaryocyte And Erythroid Lineages. These Cells Are Cd34-Positive, And Express Gata1, Gata2, C/Ebpa, And Pu.1.
CL:0001060	hematopoietic oligopotent progenitor cell, lineage-negative	A Hematopoietic Oligopotent Progenitor Cell That Has The Ability To Differentiate Into Limited Cell Types But Lacks Lineage Cell Markers And Self Renewal Capabilities. Cell Lacks Hematopoeitic Lineage Markers.	hematopoietic oligopotent progenitor cell, lineage-negative A Hematopoietic Oligopotent Progenitor Cell That Has The Ability To Differentiate Into Limited Cell Types But Lacks Lineage Cell Markers And Self Renewal Capabilities. Cell Lacks Hematopoeitic Lineage Markers.
CL:0001061	abnormal cell	A Cell Found In An Organism Or Derived From An Organism Exhibiting A Phenotype That Deviates From The Expected Phenotype Of Any Native Cell Type Of That Organism. Abnormal Cells Are Typically Found In Disease States Or Disease Models.	abnormal cell A Cell Found In An Organism Or Derived From An Organism Exhibiting A Phenotype That Deviates From The Expected Phenotype Of Any Native Cell Type Of That Organism. Abnormal Cells Are Typically Found In Disease States Or Disease Models.
CL:0001062	effector memory CD8-positive, alpha-beta T cell, terminally differentiated	A Cd8-Positive, Alpha Beta Memory T Cell With The Phenotype Cd45Ra-Positive, Cd45Ro-Negative, And Ccr7-Negative.	effector memory CD8-positive, alpha-beta T cell, terminally differentiated A Cd8-Positive, Alpha Beta Memory T Cell With The Phenotype Cd45Ra-Positive, Cd45Ro-Negative, And Ccr7-Negative.
CL:0001063	neoplastic cell	An Abnormal Cell Exhibiting Dysregulation Of Cell Proliferation Or Programmed Cell Death And Capable Of Forming A Neoplasm, An Aggregate Of Cells In The Form Of A Tumor Mass Or An Excess Number Of Abnormal Cells (Liquid Tumor) Within An Organism.	neoplastic cell An Abnormal Cell Exhibiting Dysregulation Of Cell Proliferation Or Programmed Cell Death And Capable Of Forming A Neoplasm, An Aggregate Of Cells In The Form Of A Tumor Mass Or An Excess Number Of Abnormal Cells (Liquid Tumor) Within An Organism.
CL:0001064	malignant cell	A Neoplastic Cell That Is Capable Of Entering A Surrounding Tissue	malignant cell A Neoplastic Cell That Is Capable Of Entering A Surrounding Tissue
CL:0001065	innate lymphoid cell	A Lymphocyte That Lacks Characteristic T Cell, B Cell, Myeloid Cell, And Dendritic Cell Markers, That Functions As Part Of The Innate Immune Response To Produce Cytokines And Other Effector Responses.	innate lymphoid cell A Lymphocyte That Lacks Characteristic T Cell, B Cell, Myeloid Cell, And Dendritic Cell Markers, That Functions As Part Of The Innate Immune Response To Produce Cytokines And Other Effector Responses.
CL:0001066	erythroid progenitor cell, mammalian	A Progenitor Cell Committed To The Erythroid Lineage. This Cell Is Ter119-Positive But Lacks Expression Of Other Hematopoietic Lineage Markers (Lin-Negative).	erythroid progenitor cell, mammalian A Progenitor Cell Committed To The Erythroid Lineage. This Cell Is Ter119-Positive But Lacks Expression Of Other Hematopoietic Lineage Markers (Lin-Negative).
CL:0001067	group 1 innate lymphoid cell	An Innate Lymphoid Cell That Is Capable Of Producing The Type 1 Cytokine Ifn-Gamma, But Not Th2 Or Th17 Cell-Associated Cytokines.	group 1 innate lymphoid cell An Innate Lymphoid Cell That Is Capable Of Producing The Type 1 Cytokine Ifn-Gamma, But Not Th2 Or Th17 Cell-Associated Cytokines.
CL:0001068	ILC1	A Group 1 Innate Lymphoid Cell That Is Non-Cytotoxic.	ILC1 A Group 1 Innate Lymphoid Cell That Is Non-Cytotoxic.
CL:0001069	group 2 innate lymphoid cell	An Innate Lymphoid Cell That Is Capable Of Producing T-Helper 2-Cell Associated Cytokines Upon Stimulation.	group 2 innate lymphoid cell An Innate Lymphoid Cell That Is Capable Of Producing T-Helper 2-Cell Associated Cytokines Upon Stimulation.
CL:0001070	beige adipocyte	A Fat Cell That Is Beige In Color, Thermogenic, And Which Differentiates In White Fat Tissue From A Myf5-Negative Progenitor.	beige adipocyte A Fat Cell That Is Beige In Color, Thermogenic, And Which Differentiates In White Fat Tissue From A Myf5-Negative Progenitor.
CL:0001071	group 3 innate lymphoid cell	An Innate Lymphoid Cell That Constituitively Expresses Rorgt And Is Capable Of Expressing Il17A And/Or Il-22.	group 3 innate lymphoid cell An Innate Lymphoid Cell That Constituitively Expresses Rorgt And Is Capable Of Expressing Il17A And/Or Il-22.
CL:0000738	leukocyte	An Achromatic Cell Of The Myeloid Or Lymphoid Lineages Capable Of Ameboid Movement, Found In Blood Or Other Tissue.	leukocyte An Achromatic Cell Of The Myeloid Or Lymphoid Lineages Capable Of Ameboid Movement, Found In Blood Or Other Tissue.
CL:0000740	retinal ganglion cell	The Set Of Neurons That Receives Neural Inputs Via Bipolar, Horizontal And Amacrine Cells. The Axons Of These Cells Make Up The Optic Nerve.	retinal ganglion cell The Set Of Neurons That Receives Neural Inputs Via Bipolar, Horizontal And Amacrine Cells. The Axons Of These Cells Make Up The Optic Nerve.
CL:0002001	CD34-positive, CD38-positive granulocyte monocyte progenitor	A Granulocyte Monocyte Progenitor Is Cd34-Positive, Cd38-Positive, Il-3Receptor-Alpha-Positive And Is Cd45Ra-Negative.	CD34-positive, CD38-positive granulocyte monocyte progenitor A Granulocyte Monocyte Progenitor Is Cd34-Positive, Cd38-Positive, Il-3Receptor-Alpha-Positive And Is Cd45Ra-Negative.
CL:0002002	Kit-positive granulocyte monocyte progenitor	A Granulocyte Monocyte Progenitor That Is Kit-Positive, Cd34-Positive, Fc-Gamma Receptor Ii/Ii-Positive, And Is Sca-1-Negative, Il7Ra-Negative, Cxc3R1-Negative, And Cd90-Negative.	Kit-positive granulocyte monocyte progenitor A Granulocyte Monocyte Progenitor That Is Kit-Positive, Cd34-Positive, Fc-Gamma Receptor Ii/Ii-Positive, And Is Sca-1-Negative, Il7Ra-Negative, Cxc3R1-Negative, And Cd90-Negative.
CL:0002003	CD34-positive, GlyA-negative erythroid progenitor cell	An Erythroid Progenitor Cell That Is Cd34-Positive And Is Glya-Negative.	CD34-positive, GlyA-negative erythroid progenitor cell An Erythroid Progenitor Cell That Is Cd34-Positive And Is Glya-Negative.
CL:0002004	CD34-negative, GlyA-negative proerythroblast	A Proerythoblast That Is Cd34-Negative And Glya-Negative.	CD34-negative, GlyA-negative proerythroblast A Proerythoblast That Is Cd34-Negative And Glya-Negative.
CL:0002005	CD34-positive, CD38-positive megakaryocyte erythroid progenitor cell	A Megakaryocyte Erythroid Progenitor Cell Is Cd34-Positive, Cd38-Positive And Is Il3-Receptor Alpha-Negative And Cd45Ra-Negative.	CD34-positive, CD38-positive megakaryocyte erythroid progenitor cell A Megakaryocyte Erythroid Progenitor Cell Is Cd34-Positive, Cd38-Positive And Is Il3-Receptor Alpha-Negative And Cd45Ra-Negative.
CL:0002006	Kit-positive, CD34-negative megakaryocyte erythroid progenitor cell	A Megakaryocyte Erythroid Progenitor Cell That Is Kit-Positive And Is Sca1-Negative, Cd34-Negative, Cd90-Negative, Il7R-Alpha-Negative And Fcgr Ii/Iii-Low.	Kit-positive, CD34-negative megakaryocyte erythroid progenitor cell A Megakaryocyte Erythroid Progenitor Cell That Is Kit-Positive And Is Sca1-Negative, Cd34-Negative, Cd90-Negative, Il7R-Alpha-Negative And Fcgr Ii/Iii-Low.
CL:0002007	Kit-low, CD34-positive eosinophil progenitor cell	A Lineage Marker-Negative, Cd34-Positive, Il5R-Alpha-Positive, And Sca1-Negative Eosinophil Progenitor Cell.	Kit-low, CD34-positive eosinophil progenitor cell A Lineage Marker-Negative, Cd34-Positive, Il5R-Alpha-Positive, And Sca1-Negative Eosinophil Progenitor Cell.
CL:0002008	CD34-positive, CD38-positive eosinophil progenitor cell	A Lineage Marker-Negative, Cd34-Positive, Cd38-Positive, Il3R-Alpha-Positive, Il5R-Alpha-Positive, And Cd45Ra-Negative Eosinophil Progenitor Cell.	CD34-positive, CD38-positive eosinophil progenitor cell A Lineage Marker-Negative, Cd34-Positive, Cd38-Positive, Il3R-Alpha-Positive, Il5R-Alpha-Positive, And Cd45Ra-Negative Eosinophil Progenitor Cell.
CL:0002009	macrophage dendritic cell progenitor	A Progenitor Cell That Can Give Rise To Plasmacytoid And Myeloid Dendritic Cells, And To Monocytes And Macrophages.	macrophage dendritic cell progenitor A Progenitor Cell That Can Give Rise To Plasmacytoid And Myeloid Dendritic Cells, And To Monocytes And Macrophages.
CL:0002010	pre-conventional dendritic cell	A Lin-Negative, Mhc-Ii-Negative, Cd11C-Positive, Flt3-Positive Cell With Intermediate Expression Of Sirp-Alpha.	pre-conventional dendritic cell A Lin-Negative, Mhc-Ii-Negative, Cd11C-Positive, Flt3-Positive Cell With Intermediate Expression Of Sirp-Alpha.
CL:0002011	Kit-positive macrophage dendritic cell progenitor	A Progenitor Cell That Can Give Rise To Plasmacytoid And Myeloid Dendritic Cells, And To Monocytes And Macrophages. Marker For This Cell Is Kit-High, Cd115-Positive, Cd135-Positive, Cx3Cr1-Positive, And Is Il7Ra-Negative.	Kit-positive macrophage dendritic cell progenitor A Progenitor Cell That Can Give Rise To Plasmacytoid And Myeloid Dendritic Cells, And To Monocytes And Macrophages. Marker For This Cell Is Kit-High, Cd115-Positive, Cd135-Positive, Cx3Cr1-Positive, And Is Il7Ra-Negative.
CL:0002012	Kit-low proerythroblast	A Proerythoblast That Is Kit-Low, Lyg76-Positive, And Cd71-Positive.	Kit-low proerythroblast A Proerythoblast That Is Kit-Low, Lyg76-Positive, And Cd71-Positive.
CL:0002013	GlyA-positive basophillic erythroblast	A Basophilic Erythroblast That Is Glya-Positive.	GlyA-positive basophillic erythroblast A Basophilic Erythroblast That Is Glya-Positive.
CL:0002014	Kit-negative, Ly-76 high basophilic erythroblast	A Basophilic Erythroblast That Is Lyg 76-High And Is Kit-Negative.	Kit-negative, Ly-76 high basophilic erythroblast A Basophilic Erythroblast That Is Lyg 76-High And Is Kit-Negative.
CL:0002015	Kit-negative, Ly-76 high polychromatophilic erythroblast	A Polychromatophilic Erythroblast That Is Lyg 76-High And Is Kit-Negative.	Kit-negative, Ly-76 high polychromatophilic erythroblast A Polychromatophilic Erythroblast That Is Lyg 76-High And Is Kit-Negative.
CL:0002016	CD71-low, GlyA-positive polychromatic erythroblast	A Polychromatiic Erythroblast That Is Gly-A-Positive And Cd71-Low.	CD71-low, GlyA-positive polychromatic erythroblast A Polychromatiic Erythroblast That Is Gly-A-Positive And Cd71-Low.
CL:0002017	Kit-negative, Ly-76 high orthochromatophilic erythroblasts	An Orthochromatophilic Erythroblast That Is Ter119-High, Cd71-Low, And Kit-Negative.	Kit-negative, Ly-76 high orthochromatophilic erythroblasts An Orthochromatophilic Erythroblast That Is Ter119-High, Cd71-Low, And Kit-Negative.
CL:0002018	CD71-negative, GlyA-positive orthochromatic erythroblast	An Erythroblast That Is Glya-Positive And Cd71-Negative.	CD71-negative, GlyA-positive orthochromatic erythroblast An Erythroblast That Is Glya-Positive And Cd71-Negative.
CL:0002019	Ly-76 high reticulocyte	A Reticulocyte That Is Ly76-High And Is Kit-Negative.	Ly-76 high reticulocyte A Reticulocyte That Is Ly76-High And Is Kit-Negative.
CL:0002020	GlyA-positive reticulocytes	A Reticulocyte That Is Glya-Positive.	GlyA-positive reticulocytes A Reticulocyte That Is Glya-Positive.
CL:0002021	GlyA-positive erythrocyte	An Enucleate Erythrocyte That Is Glya-Positive.	GlyA-positive erythrocyte An Enucleate Erythrocyte That Is Glya-Positive.
CL:0002022	Ly-76 high positive erythrocyte	An Enucleate Erythrocyte That Is Lyg-76-High.	Ly-76 high positive erythrocyte An Enucleate Erythrocyte That Is Lyg-76-High.
CL:0002023	CD34-positive, CD41-positive, CD42-positive megakaryocyte progenitor cell	A Megakaroycotye Progenitor Cell That Is Cd34-Positive, Cd41-Positive And Cd42-Positive On The Cell Surface.	CD34-positive, CD41-positive, CD42-positive megakaryocyte progenitor cell A Megakaroycotye Progenitor Cell That Is Cd34-Positive, Cd41-Positive And Cd42-Positive On The Cell Surface.
CL:0002024	Kit-positive megakaryocyte progenitor cell	A Megakaryocyte Progenitor Cell That Is Kit-Positive, Cd41-Positive, Cd9-Positive, Sca-1-Negative, Il7Ralpha-Negative, Cd150-Negative, And Fcgamma Receptor Ii/Iii-Low.	Kit-positive megakaryocyte progenitor cell A Megakaryocyte Progenitor Cell That Is Kit-Positive, Cd41-Positive, Cd9-Positive, Sca-1-Negative, Il7Ralpha-Negative, Cd150-Negative, And Fcgamma Receptor Ii/Iii-Low.
CL:0002025	CD34-positive, CD41-positive, CD42-negative megakaryocyte progenitor cell	A Megakaryocyte Progenitor Cell That Is Cd34-Positive, Cd41-Positive, And Cd42-Negative.	CD34-positive, CD41-positive, CD42-negative megakaryocyte progenitor cell A Megakaryocyte Progenitor Cell That Is Cd34-Positive, Cd41-Positive, And Cd42-Negative.
CL:0002026	CD34-negative, CD41-positive, CD42-positive megakaryocyte cell	A Megakaryocyte Progenitor Cell That Is Cd34-Negative, Cd41-Positive And Cd42-Positive.	CD34-negative, CD41-positive, CD42-positive megakaryocyte cell A Megakaryocyte Progenitor Cell That Is Cd34-Negative, Cd41-Positive And Cd42-Positive.
CL:0002027	CD9-positive, CD41-positive megakaryocyte cell	A Megakaryocyte Cell With Is Cd9-Positive And Cd41-Positive.	CD9-positive, CD41-positive megakaryocyte cell A Megakaryocyte Cell With Is Cd9-Positive And Cd41-Positive.
CL:0002028	basophil mast progenitor cell	A Cell Type That Can Give Rise To Basophil And Mast Cells. This Cell Is Cd34-Positive, Cd117-Positive, Cd125-Positive, Fceria-Negative, And T1/St2-Negative, And Expresses Gata-1, Gata-2, C/Ebpa	basophil mast progenitor cell A Cell Type That Can Give Rise To Basophil And Mast Cells. This Cell Is Cd34-Positive, Cd117-Positive, Cd125-Positive, Fceria-Negative, And T1/St2-Negative, And Expresses Gata-1, Gata-2, C/Ebpa
CL:0002029	Fc-epsilon RIalpha-low mast cell progenitor	A Lineage-Negative, Kit-Positive, Cd45-Positive Mast Cell Progenitor That Is Fc-Epsilon Rialpha-Low.	Fc-epsilon RIalpha-low mast cell progenitor A Lineage-Negative, Kit-Positive, Cd45-Positive Mast Cell Progenitor That Is Fc-Epsilon Rialpha-Low.
CL:0002030	Fc-epsilon RIalpha-high basophil progenitor cell	A Lineage Negative, Sca1-Negative Basophil Progenitor Cell That Is Fc Epsilon Rialpha-High.	Fc-epsilon RIalpha-high basophil progenitor cell A Lineage Negative, Sca1-Negative Basophil Progenitor Cell That Is Fc Epsilon Rialpha-High.
CL:0002031	hematopoietic lineage restricted progenitor cell	A Hematopoietic Progenitor Cell That Is Capable Of Developing Into Only One Lineage Of Hematopoietic Cells.	hematopoietic lineage restricted progenitor cell A Hematopoietic Progenitor Cell That Is Capable Of Developing Into Only One Lineage Of Hematopoietic Cells.
CL:0002032	hematopoietic oligopotent progenitor cell	A Hematopoietic Oligopotent Progenitor Cell That Has The Ability To Differentiate Into Limited Cell Types But Lacks Lineage Cell Markers And Self Renewal Capabilities. Cell Lacks Hematopoeitic Lineage Markers.	hematopoietic oligopotent progenitor cell A Hematopoietic Oligopotent Progenitor Cell That Has The Ability To Differentiate Into Limited Cell Types But Lacks Lineage Cell Markers And Self Renewal Capabilities. Cell Lacks Hematopoeitic Lineage Markers.
CL:0002033	short term hematopoietic stem cell	A Hematopoietic Stem Cell Capable Of Rapid Replenishment Of Myeloerythroid Progenitors And Limited Self Renewal Capability. This Cell Is Kit-Positive, Sca1-Positive, Cd34-Positive, Cd150-Positive, And Is Flt3-Negative.	short term hematopoietic stem cell A Hematopoietic Stem Cell Capable Of Rapid Replenishment Of Myeloerythroid Progenitors And Limited Self Renewal Capability. This Cell Is Kit-Positive, Sca1-Positive, Cd34-Positive, Cd150-Positive, And Is Flt3-Negative.
CL:0002034	long term hematopoietic stem cell	A Hematopoietic Stem Cell With Long Term Self Renewal Capability. This Cell Is Kit-Positive, Sca1-Positive, Cd150-Positive, Cd90-Low, Cd34-Negative And Flt3-Negative.	long term hematopoietic stem cell A Hematopoietic Stem Cell With Long Term Self Renewal Capability. This Cell Is Kit-Positive, Sca1-Positive, Cd150-Positive, Cd90-Low, Cd34-Negative And Flt3-Negative.
CL:0002035	Slamf1-negative multipotent progenitor cell	A Hematopoietic Progenitor That Has Restricted Self-Renewal Capability. Cell Is Kit-Positive, Ly6-Positive, Cd150-Negative And Flt3-Negative.	Slamf1-negative multipotent progenitor cell A Hematopoietic Progenitor That Has Restricted Self-Renewal Capability. Cell Is Kit-Positive, Ly6-Positive, Cd150-Negative And Flt3-Negative.
CL:0002036	Slamf1-positive multipotent progenitor cell	A Hematopoietic Progenitor That Has Some Limited Self-Renewal Capability. Cells Are Lin-Negative, Kit-Positive, Cd34-Positive, And Slamf1-Positive.	Slamf1-positive multipotent progenitor cell A Hematopoietic Progenitor That Has Some Limited Self-Renewal Capability. Cells Are Lin-Negative, Kit-Positive, Cd34-Positive, And Slamf1-Positive.
CL:0002037	CD2-positive, CD5-positive, CD44-positive alpha-beta intraepithelial T cell	Intraepithelial T Cells With A Memory Phenotype Of Cd2-Positive, Cd5-Positive, And Cd44-Positive.	CD2-positive, CD5-positive, CD44-positive alpha-beta intraepithelial T cell Intraepithelial T Cells With A Memory Phenotype Of Cd2-Positive, Cd5-Positive, And Cd44-Positive.
CL:0002038	T follicular helper cell	A Cd4-Positive, Cxcr5-Positive, Ccr7-Negative Alpha-Beta T Cell Located In Follicles Of Secondary Lymph Nodes That Expresses Is Bcl6-High, Icos-High And Pd1-High, And Stimulates Follicular B Cells To Undergo Class-Switching And Antibody Production.	T follicular helper cell A Cd4-Positive, Cxcr5-Positive, Ccr7-Negative Alpha-Beta T Cell Located In Follicles Of Secondary Lymph Nodes That Expresses Is Bcl6-High, Icos-High And Pd1-High, And Stimulates Follicular B Cells To Undergo Class-Switching And Antibody Production.
CL:0002039	immature NK T cell stage I	A Cd24-High, Cd4-Low, Cd8-Low, Cd44-Negative, Nk1.1-Negative Nk T Cell.	immature NK T cell stage I A Cd24-High, Cd4-Low, Cd8-Low, Cd44-Negative, Nk1.1-Negative Nk T Cell.
CL:0002040	immature NK T cell stage II	A Cd24-Low, Cd44-Negative, Nk1.1-Negative Nk T Cell.	immature NK T cell stage II A Cd24-Low, Cd44-Negative, Nk1.1-Negative Nk T Cell.
CL:0002041	immature NK T cell stage III	A Cd24-Low, Cd44-Positive, Dx5-Low, Nk1.1-Negative Nk T Cell.	immature NK T cell stage III A Cd24-Low, Cd44-Positive, Dx5-Low, Nk1.1-Negative Nk T Cell.
CL:0002042	immature NK T cell stage IV	A Cd24-Low, Cd44-Positive, Dx5-High, Nk1.1-Negative Nk T Cell.	immature NK T cell stage IV A Cd24-Low, Cd44-Positive, Dx5-High, Nk1.1-Negative Nk T Cell.
CL:0002043	CD34-positive, CD38-negative multipotent progenitor cell	A Hematopoietic Multipotent Progenitor Cell That Is Cd34-Positive, Cd38-Negative, Cd45Ra-Negative, And Cd90-Negative.	CD34-positive, CD38-negative multipotent progenitor cell A Hematopoietic Multipotent Progenitor Cell That Is Cd34-Positive, Cd38-Negative, Cd45Ra-Negative, And Cd90-Negative.
CL:0002044	Kit-positive, integrin beta7-high basophil mast progenitor cell	A Basophil Mast Progenitor Cell That Is Beta-7 Integrin-High, Kit-Positive Fcrgammaii/Iii-Positive And Sca1-Negative.	Kit-positive, integrin beta7-high basophil mast progenitor cell A Basophil Mast Progenitor Cell That Is Beta-7 Integrin-High, Kit-Positive Fcrgammaii/Iii-Positive And Sca1-Negative.
CL:0002045	Fraction A pre-pro B cell	A Pro-B Cell That Cd45R/B220-Positive, Cd43-Positive, Hsa-Low, Bp-1-Negative And Ly6C-Negative. This Cell Type Is Also Described As Being Lin-Negative, Aa4-Positive, Kit-Positive, Il7Ra-Positive And Cd45R-Positive.	Fraction A pre-pro B cell A Pro-B Cell That Cd45R/B220-Positive, Cd43-Positive, Hsa-Low, Bp-1-Negative And Ly6C-Negative. This Cell Type Is Also Described As Being Lin-Negative, Aa4-Positive, Kit-Positive, Il7Ra-Positive And Cd45R-Positive.
CL:0002046	early pro-B cell	A Pro-B Cell That Is Cd22-Positive, Cd34-Positive, Cd38-Positive And Tdt-Positive (Has Tdt Activity). Pre-Bcr Is Expressed On The Cell Surface. Cell Is Cd19-Negative, Cd20-Negative, Complement Receptor Type 2-Negative And Cd10-Low. D-To-J Recombination Of The Heavy Chain Occurs At This Stage.	early pro-B cell A Pro-B Cell That Is Cd22-Positive, Cd34-Positive, Cd38-Positive And Tdt-Positive (Has Tdt Activity). Pre-Bcr Is Expressed On The Cell Surface. Cell Is Cd19-Negative, Cd20-Negative, Complement Receptor Type 2-Negative And Cd10-Low. D-To-J Recombination Of The Heavy Chain Occurs At This Stage.
CL:0002047	Fraction B precursor B cell	A Precursor B Cell That Is Cd45Ra-Positive, Cd43-Positive, Cd24-Positive And Bp-1-Negative.	Fraction B precursor B cell A Precursor B Cell That Is Cd45Ra-Positive, Cd43-Positive, Cd24-Positive And Bp-1-Negative.
CL:0002048	late pro-B cell	A Pre-B Cell Precursor Is Cd19-Low, Cd22-Positive , Cd34-Positive, Cd38-Positive.	late pro-B cell A Pre-B Cell Precursor Is Cd19-Low, Cd22-Positive , Cd34-Positive, Cd38-Positive.
CL:0002049	Fraction C precursor B cell	A Precursor B Cell Is Cd45R-Positive, Cd43-Positive, Cd24-Positive, And Bp-Positive. Intracellularly Expression Of Surrogate Light Chain, Rag1 And Rag2, Tdt, Occurs While There Is No Expression Of Mu Heavy Chain.	Fraction C precursor B cell A Precursor B Cell Is Cd45R-Positive, Cd43-Positive, Cd24-Positive, And Bp-Positive. Intracellularly Expression Of Surrogate Light Chain, Rag1 And Rag2, Tdt, Occurs While There Is No Expression Of Mu Heavy Chain.
CL:0002050	Fraction C' precursor B cell	A Pre-Bcr-Positive Precursor B Cell That Is Cd24-High, Cd25-Positive, Cd43-Positive, Cd45R-Positive And Bp-Positive.	Fraction C' precursor B cell A Pre-Bcr-Positive Precursor B Cell That Is Cd24-High, Cd25-Positive, Cd43-Positive, Cd45R-Positive And Bp-Positive.
CL:0002051	CD38-high pre-BCR positive cell	A Pre-Bcr Positive T Cell That Is Cd38-High.	CD38-high pre-BCR positive cell A Pre-Bcr Positive T Cell That Is Cd38-High.
CL:0002052	Fraction D precursor B cell	A Pre-B Cell That Is Pre-Bcr-Negative, And The Kappa- And Lambda- Light Immunoglobulin Light Chain-Negative, Cd43-Low, And Is Bp-1-Positive, Cd45R-Positive And Cd25-Positive. This Cell Type Is Also Described As Being Aa4-Positive, Igm-Negative, Cd19-Positive, Cd43-Low/Negative, And Hsa-Positive.	Fraction D precursor B cell A Pre-B Cell That Is Pre-Bcr-Negative, And The Kappa- And Lambda- Light Immunoglobulin Light Chain-Negative, Cd43-Low, And Is Bp-1-Positive, Cd45R-Positive And Cd25-Positive. This Cell Type Is Also Described As Being Aa4-Positive, Igm-Negative, Cd19-Positive, Cd43-Low/Negative, And Hsa-Positive.
CL:0002053	CD22-positive, CD38-low small pre-B cell	A Small Pre-B Cell That Is Cd22-Positive And Cd38-Low.	CD22-positive, CD38-low small pre-B cell A Small Pre-B Cell That Is Cd22-Positive And Cd38-Low.
