ID	cell_name	defination	description
CL:0000594	skeletal muscle satellite cell	An Elongated, Spindle-Shaped, Cell That Is Located Between The Basal Lamina And The Plasmalemma Of A Muscle Fiber. These Cells Are Mostly Quiescent, But Upon Activation They Divide To Produce Cells That Generate New Muscle Fibers.	skeletal muscle satellite cell An Elongated, Spindle-Shaped, Cell That Is Located Between The Basal Lamina And The Plasmalemma Of A Muscle Fiber. These Cells Are Mostly Quiescent, But Upon Activation They Divide To Produce Cells That Generate New Muscle Fibers.
CL:0000595	enucleate erythrocyte	An Erythrocyte Lacking A Nucleus.	enucleate erythrocyte An Erythrocyte Lacking A Nucleus.
CL:0000596	sexual spore	A Spore Formed Following Meiosis. Sometimes Following Meiosis, Prospores May Undergo One Or More Rounds Of Mitosis Before They Are Fully Mature.	sexual spore A Spore Formed Following Meiosis. Sometimes Following Meiosis, Prospores May Undergo One Or More Rounds Of Mitosis Before They Are Fully Mature.
CL:0000597	microconidium	The Smaller Of Two Types Of Asexual Spores Formed By Some Fungi. An Ovoid To Pear-Shaped Asexual Spore That Contains Very Little Cytoplasm And Organelles, Is Uninucleate, And Forms In Vegetative Hypae Within A Mycelium. Micronidia Are Extruded From The Hyphal Cell Wall.	microconidium The Smaller Of Two Types Of Asexual Spores Formed By Some Fungi. An Ovoid To Pear-Shaped Asexual Spore That Contains Very Little Cytoplasm And Organelles, Is Uninucleate, And Forms In Vegetative Hypae Within A Mycelium. Micronidia Are Extruded From The Hyphal Cell Wall.
CL:0000598	pyramidal neuron	Pyramidal Neurons Have A Pyramid-Shaped Soma With The Apex And An Apical Dendrite Pointed Toward The Pial Surface And Other Dendrites And An Axon Emerging From The Base. The Axons May Have Local Collaterals But Also Project Outside Their  Region. Pyramidal Neurons Are Found In The Cerebral Cortex, The Hippocampus, And The Amygdala.	pyramidal neuron Pyramidal Neurons Have A Pyramid-Shaped Soma With The Apex And An Apical Dendrite Pointed Toward The Pial Surface And Other Dendrites And An Axon Emerging From The Base. The Axons May Have Local Collaterals But Also Project Outside Their  Region. Pyramidal Neurons Are Found In The Cerebral Cortex, The Hippocampus, And The Amygdala.
CL:0000599	conidium	An Asexual, Nonmotile Spore Formed By Higher Fungi; Conidia Are Usually Made From The Side Or Tip Of Specialized Sporogenous Cells And Do Not Form By Progressive Cleavage Of The Cytoplasm.	conidium An Asexual, Nonmotile Spore Formed By Higher Fungi; Conidia Are Usually Made From The Side Or Tip Of Specialized Sporogenous Cells And Do Not Form By Progressive Cleavage Of The Cytoplasm.
CL:0000600	heterokaryon	A Fungal Cell With Two Or More Genetically Distinct Nuclei.	heterokaryon A Fungal Cell With Two Or More Genetically Distinct Nuclei.
CL:0000601	outer hair cell	A Mechanoreceptor In The Organ Of Corti. In Mammals The Outer Hair Cells Are Arranged In Three Rows Which Are Further From The Modiolus Than The Single Row Of Inner Hair Cells. The Motile Properties Of The Outer Hair Cells May Contribute Actively To Tuning The Sensitivity And Frequency Selectivity Of The Cochlea.	outer hair cell A Mechanoreceptor In The Organ Of Corti. In Mammals The Outer Hair Cells Are Arranged In Three Rows Which Are Further From The Modiolus Than The Single Row Of Inner Hair Cells. The Motile Properties Of The Outer Hair Cells May Contribute Actively To Tuning The Sensitivity And Frequency Selectivity Of The Cochlea.
CL:0000602	pressoreceptor cell	A Receptor In The Vascular System, Particularly The Aorta And Carotid Sinus, Which Is Sensitive To Stretch Of The Vessel Walls.	pressoreceptor cell A Receptor In The Vascular System, Particularly The Aorta And Carotid Sinus, Which Is Sensitive To Stretch Of The Vessel Walls.
CL:0000603	dikaryon	A Fungal Cell With Two Genetically Distinct Haploid Nuclei.	dikaryon A Fungal Cell With Two Genetically Distinct Haploid Nuclei.
CL:0000604	retinal rod cell	One Of The Two Photoreceptor Cell Types Of The Vertebrate Retina. In Rods The Photopigment Is In Stacks Of Membranous Disks Separate From The Outer Cell Membrane. Rods Are More Sensitive To Light Than Cones, But Rod Mediated Vision Has Less Spatial And Temporal Resolution Than Cone Vision.	retinal rod cell One Of The Two Photoreceptor Cell Types Of The Vertebrate Retina. In Rods The Photopigment Is In Stacks Of Membranous Disks Separate From The Outer Cell Membrane. Rods Are More Sensitive To Light Than Cones, But Rod Mediated Vision Has Less Spatial And Temporal Resolution Than Cone Vision.
CL:0000605	fungal asexual spore	A Spore Formed Following Mitosis Or Mitoses.	fungal asexual spore A Spore Formed Following Mitosis Or Mitoses.
CL:0000606	macroconidium	The Larger Of Two Types Of Asexual Spores Formed By Some Fungi; Usually Round Or Oblong.	macroconidium The Larger Of Two Types Of Asexual Spores Formed By Some Fungi; Usually Round Or Oblong.
CL:0000607	ascospore	A Thick Walled Spore That Stores And Protects One Or More Nuclei Following Sexual Reproduction In An Ascomycete.	ascospore A Thick Walled Spore That Stores And Protects One Or More Nuclei Following Sexual Reproduction In An Ascomycete.
CL:0000608	zygospore	A Thick Walled, Sexual, Resting Spore Formed By Zygomycetes; Sometimes Refers To The Spore And The Multi-Layered Cell Wall That Encloses The Spore, The Zygosporangium.	zygospore A Thick Walled, Sexual, Resting Spore Formed By Zygomycetes; Sometimes Refers To The Spore And The Multi-Layered Cell Wall That Encloses The Spore, The Zygosporangium.
CL:0000609	vestibular hair cell	A Mechanoreceptor Located In The Acoustic Maculae And The Semicircular Canals That Mediates The Sense Of Balance, Movement, And Head Position. The Vestibular Hair Cells Are Connected To Accessory Structures In Such A Way That Movements Of The Head Displace Their Stereocilia. This Influences The Membrane Potential Of The Cells Which Relay Information About Movements Via The Vestibular Part Of The Vestibulocochlear Nerve To The Brain Stem.	vestibular hair cell A Mechanoreceptor Located In The Acoustic Maculae And The Semicircular Canals That Mediates The Sense Of Balance, Movement, And Head Position. The Vestibular Hair Cells Are Connected To Accessory Structures In Such A Way That Movements Of The Head Displace Their Stereocilia. This Influences The Membrane Potential Of The Cells Which Relay Information About Movements Via The Vestibular Part Of The Vestibulocochlear Nerve To The Brain Stem.
CL:0000610	obsolete plant cell		obsolete plant cell
CL:0000611	eosinophil progenitor cell		eosinophil progenitor cell
CL:0000612	eosinophilic myelocyte	A Eosinophil Precursor In The Granulocytic Series, Being A Cell Intermediate In Development Between A Promyelocyte And A Metamyelocyte;In This Stage, Production Of Primary Granules Is Complete And Eosinophil-Specific Granules Has Started. No Nucleolus Is Present. These Cells Are Integrin Alpha-M-Positive, Cd13-Positive, Cd15-Positive, Cd16-Negative, Cd24-Positive, And Cd33-Positive.	eosinophilic myelocyte A Eosinophil Precursor In The Granulocytic Series, Being A Cell Intermediate In Development Between A Promyelocyte And A Metamyelocyte;In This Stage, Production Of Primary Granules Is Complete And Eosinophil-Specific Granules Has Started. No Nucleolus Is Present. These Cells Are Integrin Alpha-M-Positive, Cd13-Positive, Cd15-Positive, Cd16-Negative, Cd24-Positive, And Cd33-Positive.
CL:0000613	basophil progenitor cell	A Progenitor Cell Committed To The Basophil Lineage. This Cell Lacks Hematopoietic Lineage Markers (Lin-Negative) And Is Cd34-Positive, T1/St2-Low, Cd117-Negative, And Fceria-High. This Cell Also Expresses Gata-1, Gata-2 And C/Ebpa.	basophil progenitor cell A Progenitor Cell Committed To The Basophil Lineage. This Cell Lacks Hematopoietic Lineage Markers (Lin-Negative) And Is Cd34-Positive, T1/St2-Low, Cd117-Negative, And Fceria-High. This Cell Also Expresses Gata-1, Gata-2 And C/Ebpa.
CL:0000614	basophilic myelocyte	A Basophil Precursor In The Granulocytic Series, Being A Cell Intermediate In Development Between A Promyelocyte And A Metamyelocyte; In This Stage, Production Of Primary Granules Is Complete And Basophil-Specific Granules Has Started. No Nucleolus Is Present. Markers Are Being Integrin Alpha-M-Positive, Fucosyltransferase Fut4-Positive, Cd33-Positive, Cd24-Positive, Aminopeptidase N-Positive.	basophilic myelocyte A Basophil Precursor In The Granulocytic Series, Being A Cell Intermediate In Development Between A Promyelocyte And A Metamyelocyte; In This Stage, Production Of Primary Granules Is Complete And Basophil-Specific Granules Has Started. No Nucleolus Is Present. Markers Are Being Integrin Alpha-M-Positive, Fucosyltransferase Fut4-Positive, Cd33-Positive, Cd24-Positive, Aminopeptidase N-Positive.
CL:0000615	basidiospore	A Thick Walled Spore Containing One Or More Haploid Nuclei Produced By Sexual Reproduction In An Basidiomycete; Formed Externally On Extrusions Of The Basidium.	basidiospore A Thick Walled Spore Containing One Or More Haploid Nuclei Produced By Sexual Reproduction In An Basidiomycete; Formed Externally On Extrusions Of The Basidium.
CL:0000616	obsolete sporangiospore	Obsolete: A Walled Spore Produced In A Sporangium.	obsolete sporangiospore Obsolete: A Walled Spore Produced In A Sporangium.
CL:0000617	GABAergic neuron	A Neuron That Uses Gaba As A Vesicular Neurotransmitter	GABAergic neuron A Neuron That Uses Gaba As A Vesicular Neurotransmitter
CL:0000618	sheath cell		sheath cell
CL:0000619	support cell (sensu Nematoda)		support cell (sensu Nematoda)
CL:0000620	obsolete zoospore	Obsolete: A Sporangiospore That Is Motile, Having Flagella.	obsolete zoospore Obsolete: A Sporangiospore That Is Motile, Having Flagella.
CL:0000621	fusion competent myoblast	A Myoblast That Is Committed To A Myotube-Specific Program Of Differentiation But Not Yet Fused. It Undergoes Very Limited Additional Proliferation. After Fusion, It Will Take On A Muscle Identity Specified By A `Muscle Founder Cell` (Cl:0008006).	fusion competent myoblast A Myoblast That Is Committed To A Myotube-Specific Program Of Differentiation But Not Yet Fused. It Undergoes Very Limited Additional Proliferation. After Fusion, It Will Take On A Muscle Identity Specified By A `Muscle Founder Cell` (Cl:0008006).
CL:0000622	acinar cell	A Secretory Cell That Is Grouped Together With Other Cells Of The Same Type To Form Grape Shaped Clusters Known As Acini (Singular Acinus).	acinar cell A Secretory Cell That Is Grouped Together With Other Cells Of The Same Type To Form Grape Shaped Clusters Known As Acini (Singular Acinus).
CL:0000623	natural killer cell	A Lymphocyte That Can Spontaneously Kill A Variety Of Target Cells Without Prior Antigenic Activation Via Germline Encoded Activation Receptors And Also Regulate Immune Responses Via Cytokine Release And Direct Contact With Other Cells.	natural killer cell A Lymphocyte That Can Spontaneously Kill A Variety Of Target Cells Without Prior Antigenic Activation Via Germline Encoded Activation Receptors And Also Regulate Immune Responses Via Cytokine Release And Direct Contact With Other Cells.
CL:0000624	CD4-positive, alpha-beta T cell	A Mature Alpha-Beta T Cell That Expresses An Alpha-Beta T Cell Receptor And The Cd4 Coreceptor.	CD4-positive, alpha-beta T cell A Mature Alpha-Beta T Cell That Expresses An Alpha-Beta T Cell Receptor And The Cd4 Coreceptor.
CL:0000625	CD8-positive, alpha-beta T cell	A T Cell Expressing An Alpha-Beta T Cell Receptor And The Cd8 Coreceptor.	CD8-positive, alpha-beta T cell A T Cell Expressing An Alpha-Beta T Cell Receptor And The Cd8 Coreceptor.
CL:0000626	olfactory granule cell	Granule Cell That Is Part Of The Olfactory Bulb.	olfactory granule cell Granule Cell That Is Part Of The Olfactory Bulb.
CL:0000627	transporting cell	A Cell Involved In Transporting Nutrients, Minerals, Water, Gases And Other Chemicals Between Cells For A Variety Of Purposes Including Conveying Nutrition To Other Tissues, Removing Waste Products From The Tissues, Conveying Gases For Respiration, Distributing Heat And Repelling Invasion Of Foreign Substances.	transporting cell A Cell Involved In Transporting Nutrients, Minerals, Water, Gases And Other Chemicals Between Cells For A Variety Of Purposes Including Conveying Nutrition To Other Tissues, Removing Waste Products From The Tissues, Conveying Gases For Respiration, Distributing Heat And Repelling Invasion Of Foreign Substances.
CL:0000628	photosynthetic cell	A Cell That Can Perform Photosynthesis, In Which Carbohydrates Are Synthesized From Carbon Dioxide And Water, Using Light As The Energy Source.	photosynthetic cell A Cell That Can Perform Photosynthesis, In Which Carbohydrates Are Synthesized From Carbon Dioxide And Water, Using Light As The Energy Source.
CL:0000629	storage cell	A Cell That Is Specialized To Store A Particular Substance(S), Which Is(Are) Later Released From The Store For A Particular Purpose.	storage cell A Cell That Is Specialized To Store A Particular Substance(S), Which Is(Are) Later Released From The Store For A Particular Purpose.
CL:0000630	supportive cell	A Cell Whose Primary Function Is To Support Other Cell Types.	supportive cell A Cell Whose Primary Function Is To Support Other Cell Types.
CL:0000631	labyrinth supporting cell	Cells Forming A Framework Supporting The Organ Of Corti. Specific Cells Are Those Of Claudius, Deiters And Hensen.	labyrinth supporting cell Cells Forming A Framework Supporting The Organ Of Corti. Specific Cells Are Those Of Claudius, Deiters And Hensen.
CL:0000632	hepatic stellate cell	A Cell That Is Found In The Perisinusoidal Space Of The Liver That Is Capable Of Multiple Roles Including Storage Of Retinol, Presentation Of Antigen To T Cells (Including Cd1D-Restricted Nkt Cells), And Upon Activation, Production Of Extracellular Matrix Components That Can Contribute To Liver Fibrosis. This Activated State Has A Myofibroblast-Like Phenotype, Though It'S Not Clear In The Literature If This Is Terminally Differentiated. This Cell Type Comprises Approximately 8-15% Of Total Cells In The Liver.	hepatic stellate cell A Cell That Is Found In The Perisinusoidal Space Of The Liver That Is Capable Of Multiple Roles Including Storage Of Retinol, Presentation Of Antigen To T Cells (Including Cd1D-Restricted Nkt Cells), And Upon Activation, Production Of Extracellular Matrix Components That Can Contribute To Liver Fibrosis. This Activated State Has A Myofibroblast-Like Phenotype, Though It'S Not Clear In The Literature If This Is Terminally Differentiated. This Cell Type Comprises Approximately 8-15% Of Total Cells In The Liver.
CL:0000633	Hensen cell	A Tall Supporting Cell That Is Arranged In Rows Adjacent To The Last Row Of Outer Phalangeal Cells. This Cell Type Constitutes The Outer Border Of The Organ Of Corti.	Hensen cell A Tall Supporting Cell That Is Arranged In Rows Adjacent To The Last Row Of Outer Phalangeal Cells. This Cell Type Constitutes The Outer Border Of The Organ Of Corti.
CL:0000634	Claudius cell	A Cuboidal Cell Which Along With Boettcher'S Cells Form The Floor Of The External Spiral Sulcus, External To The Organ Of Corti.	Claudius cell A Cuboidal Cell Which Along With Boettcher'S Cells Form The Floor Of The External Spiral Sulcus, External To The Organ Of Corti.
CL:0000635	Deiter's cell	The Outer Phalangeal Cells Of The Organ Of Corti. This Cell Holds The Base Of The Hair Cell In A Cup-Shaped Depression.	Deiter's cell The Outer Phalangeal Cells Of The Organ Of Corti. This Cell Holds The Base Of The Hair Cell In A Cup-Shaped Depression.
CL:0000636	Mueller cell		Mueller cell
CL:0000637	chromophil cell of anterior pituitary gland	A Cell That Stains Readily In The Anterior Pituitary Gland.	chromophil cell of anterior pituitary gland A Cell That Stains Readily In The Anterior Pituitary Gland.
CL:0000638	acidophil cell of pars distalis of adenohypophysis	An Acidophilic Chromophil Cell That Of The Anterior Pituitary Gland.	acidophil cell of pars distalis of adenohypophysis An Acidophilic Chromophil Cell That Of The Anterior Pituitary Gland.
CL:0000639	basophil cell of pars distalis of adenohypophysis	A Basophillic Chromophil Cell That Of The Anterior Pituitary Gland.	basophil cell of pars distalis of adenohypophysis A Basophillic Chromophil Cell That Of The Anterior Pituitary Gland.
CL:0000641	chromophobe cell	A Cell That Is Resistant To Stains.	chromophobe cell A Cell That Is Resistant To Stains.
CL:0000642	folliculostellate cell	A Supportive Cell Of The Vertebrate Pituitary That Provides Macromolecular Transport And Secretes Hormones.	folliculostellate cell A Supportive Cell Of The Vertebrate Pituitary That Provides Macromolecular Transport And Secretes Hormones.
CL:0000644	Bergmann glial cell	Type Of Radial Astrocyte In The Cerebellar Cortex That Have Their Cell Bodies In The Purkinje Cell Layer And Processes That Extend Into The Molecular Layer, Terminating With Bulbous Endfeet At The Pial Surface. Bergmann Glia Express High Densities Of Glutamate Transporters That Limit Diffusion Of The Neurotransmitter Glutamate During Its Release From Synaptic Terminals. Besides Their Role In Early Development Of The Cerebellum, Bergmann Glia Are Also Required For The Pruning Or Addition Of Synapses.	Bergmann glial cell Type Of Radial Astrocyte In The Cerebellar Cortex That Have Their Cell Bodies In The Purkinje Cell Layer And Processes That Extend Into The Molecular Layer, Terminating With Bulbous Endfeet At The Pial Surface. Bergmann Glia Express High Densities Of Glutamate Transporters That Limit Diffusion Of The Neurotransmitter Glutamate During Its Release From Synaptic Terminals. Besides Their Role In Early Development Of The Cerebellum, Bergmann Glia Are Also Required For The Pruning Or Addition Of Synapses.
CL:0000645	pituicyte	A Cell With Long Processes Running Parallel To Adjacent Axons In The Proximal Infundibulum Of The Neurohypophysis. These Processes Form A Three-Dimensional Network Among The Axons Of The Hypothalamic Neurosecretory Cells And Are Connected By Gap Junctions Which Provide For Their Metabolic Coupling. This Cell Type Constitutes Most Of The Nonexcitable Tissue In The Neurohypophsis; Function May Include Possibly Acting As An Intermediate In The Modulation Of Oxytocin And Vasopressin Release. This Cell Type Is Highly Variable In Size And Shape And Commonly Contain Lipid Droplets And Deposits Of Lipochrome Pigment.	pituicyte A Cell With Long Processes Running Parallel To Adjacent Axons In The Proximal Infundibulum Of The Neurohypophysis. These Processes Form A Three-Dimensional Network Among The Axons Of The Hypothalamic Neurosecretory Cells And Are Connected By Gap Junctions Which Provide For Their Metabolic Coupling. This Cell Type Constitutes Most Of The Nonexcitable Tissue In The Neurohypophsis; Function May Include Possibly Acting As An Intermediate In The Modulation Of Oxytocin And Vasopressin Release. This Cell Type Is Highly Variable In Size And Shape And Commonly Contain Lipid Droplets And Deposits Of Lipochrome Pigment.
CL:0000646	basal cell	Undifferentiated; Mitotic Stem Cell For Other Epithelial Cell Types; Rounded Or Elliptical With Little Cytoplasm And Few Organelles; Contain Cytokeratin Intermediate Filament.	basal cell Undifferentiated; Mitotic Stem Cell For Other Epithelial Cell Types; Rounded Or Elliptical With Little Cytoplasm And Few Organelles; Contain Cytokeratin Intermediate Filament.
CL:0000647	multinucleated giant cell	A Phagocytic Cell Formed By The Fusion Of Macrophages, Occurs In Chronic Inflammatory Responses To Persistent Microorganism Such As M.Tuberculosis, Component Of Granulomas. Sometimes Used To Refer To Megakaryocytes.	multinucleated giant cell A Phagocytic Cell Formed By The Fusion Of Macrophages, Occurs In Chronic Inflammatory Responses To Persistent Microorganism Such As M.Tuberculosis, Component Of Granulomas. Sometimes Used To Refer To Megakaryocytes.
CL:0000648	kidney granular cell	A Smooth Muscle Cell That Synthesizes, Stores, And Secretes The Enzyme Renin. This Cell Type Are Located In The Wall Of The Afferent Arteriole At The Entrance To The Glomerulus. While Having A Different Origin Than Other Kidney Smooth Muscle Cells, This Cell Type Expresses Smooth Muscle Actin Upon Maturation.	kidney granular cell A Smooth Muscle Cell That Synthesizes, Stores, And Secretes The Enzyme Renin. This Cell Type Are Located In The Wall Of The Afferent Arteriole At The Entrance To The Glomerulus. While Having A Different Origin Than Other Kidney Smooth Muscle Cells, This Cell Type Expresses Smooth Muscle Actin Upon Maturation.
CL:0000649	prickle cell	A Cell With Delicate Radiating Processes Known As Desmosomes That Form Intercellular Bridges Between Other Cells Of This Type. This Cell Type Forms The Stratum Spinosum (Prickle Cell Layer). A Function Of This Cell Is To Generate Keratin.	prickle cell A Cell With Delicate Radiating Processes Known As Desmosomes That Form Intercellular Bridges Between Other Cells Of This Type. This Cell Type Forms The Stratum Spinosum (Prickle Cell Layer). A Function Of This Cell Is To Generate Keratin.
CL:0000650	mesangial cell	A Cell Type That Encapsulates The Capillaries And Venules In The Kidney. This Cell Secretes Mesangial Matrix That Provides The Structural Support For The Capillaries.	mesangial cell A Cell Type That Encapsulates The Capillaries And Venules In The Kidney. This Cell Secretes Mesangial Matrix That Provides The Structural Support For The Capillaries.
CL:0000651	mucous neck cell	A Mucus-Secreting Cell, With Numerous Apical Secretory Vesicles Containing Mucins; Nucleus Are Basally Displaced; Numerous At The Neck Of Mucus Secreting Glands	mucous neck cell A Mucus-Secreting Cell, With Numerous Apical Secretory Vesicles Containing Mucins; Nucleus Are Basally Displaced; Numerous At The Neck Of Mucus Secreting Glands
CL:0000652	pinealocyte	This Cell Type Produces And Secretes Melatonin And Forms The Pineal Parenchyma. Extending From Each Cell Body, Which Has A Spherical, Oval Or Lobulated Mucleus, Are One Or More Tortuous Basophilic Processes, Containing Parallel Microtubules Known As Synaptic Ribbons. These Processes End In Expanded Terminal Buds Near Capillaries Or Less, Frequently, Ependymal Cells Of The Pineal Recess. The Terminal Buds Contain Granular Endoplasmic Reticulum, Mitochondria And Electron-Dense Cored Vesicles, Which Store Monoamines And Polypeptide Hormones, Release Of Which Appears To Require Sympathetic Innervation.	pinealocyte This Cell Type Produces And Secretes Melatonin And Forms The Pineal Parenchyma. Extending From Each Cell Body, Which Has A Spherical, Oval Or Lobulated Mucleus, Are One Or More Tortuous Basophilic Processes, Containing Parallel Microtubules Known As Synaptic Ribbons. These Processes End In Expanded Terminal Buds Near Capillaries Or Less, Frequently, Ependymal Cells Of The Pineal Recess. The Terminal Buds Contain Granular Endoplasmic Reticulum, Mitochondria And Electron-Dense Cored Vesicles, Which Store Monoamines And Polypeptide Hormones, Release Of Which Appears To Require Sympathetic Innervation.
CL:0000653	glomerular visceral epithelial cell	"A Glomerular Visceral Epithelial Cell Is A Specialized Kidney Epithelial Cell That Contains ""Feet"" That Interdigitate With The ""Feet"" Of Other Glomerular Epithelial Cells."	"glomerular visceral epithelial cell A Glomerular Visceral Epithelial Cell Is A Specialized Kidney Epithelial Cell That Contains ""Feet"" That Interdigitate With The ""Feet"" Of Other Glomerular Epithelial Cells."
CL:0000654	primary oocyte	A Primary Oocyte Is An Oocyte That Has Not Completed Female Meosis I.	primary oocyte A Primary Oocyte Is An Oocyte That Has Not Completed Female Meosis I.
CL:0000655	secondary oocyte	A Secondary Oocyte Is An Oocyte That Has Not Completed Meiosis Ii.	secondary oocyte A Secondary Oocyte Is An Oocyte That Has Not Completed Meiosis Ii.
CL:0000656	primary spermatocyte	A Diploid Cell That Has Derived From A Spermatogonium And Can Subsequently Begin Meiosis And Divide Into Two Haploid Secondary Spermatocytes.	primary spermatocyte A Diploid Cell That Has Derived From A Spermatogonium And Can Subsequently Begin Meiosis And Divide Into Two Haploid Secondary Spermatocytes.
CL:0000657	secondary spermatocyte	One Of The Two Haploid Cells Into Which A Primary Spermatocyte Divides, And Which In Turn Gives Origin To Spermatids.	secondary spermatocyte One Of The Two Haploid Cells Into Which A Primary Spermatocyte Divides, And Which In Turn Gives Origin To Spermatids.
CL:0000658	cuticle secreting cell	An Epithelial Cell That Secretes Cuticle.	cuticle secreting cell An Epithelial Cell That Secretes Cuticle.
CL:0000659	eggshell secreting cell	An Extracellular Matrix Secreting Cell That Secretes Eggshell.	eggshell secreting cell An Extracellular Matrix Secreting Cell That Secretes Eggshell.
CL:0000660	glycocalyx secreting cell	An Extracellular Matrix Secreting Cell That Secretes Glycocalyx.	glycocalyx secreting cell An Extracellular Matrix Secreting Cell That Secretes Glycocalyx.
CL:0000661	distal tip cell (sensu Nematoda)		distal tip cell (sensu Nematoda)
CL:0000662	neuroglioblast (sensu Nematoda)		neuroglioblast (sensu Nematoda)
CL:0000663	valve cell		valve cell
CL:0000664	closable valve cell		closable valve cell
CL:0000665	permanently open valve cell		permanently open valve cell
CL:0000666	fenestrated cell		fenestrated cell
CL:0000667	collagen secreting cell	An Extracellular Matrix Secreting Cell That Secretes Collagen.	collagen secreting cell An Extracellular Matrix Secreting Cell That Secretes Collagen.
CL:0000668	obsolete parenchymal cell	Obsolete: The Cell Characteristic Of An Organ, As Distinguished From Associated Connective Or Supporting Tissues.	obsolete parenchymal cell Obsolete: The Cell Characteristic Of An Organ, As Distinguished From Associated Connective Or Supporting Tissues.
