ID	cell_name	defination	description
CL:0002499	spongiotrophoblast cell	A Trophoblast Cell That Arises In The Junctional Zone (Basal Plate) Of The Placenta.	spongiotrophoblast cell A Trophoblast Cell That Arises In The Junctional Zone (Basal Plate) Of The Placenta.
CL:0002500	P enteroendocrine cell	A P/D1 Enteroendocrine Cell That Is Grimelius Positive And Stores Bombesin-Like Polypeptide.	P enteroendocrine cell A P/D1 Enteroendocrine Cell That Is Grimelius Positive And Stores Bombesin-Like Polypeptide.
CL:0002501	type D1 enteroendocrine cell	A P/D1 Enteroendocrine Cell That Is Argyrophilic And Stores Vasoactive Intestinal Polypeptide.	type D1 enteroendocrine cell A P/D1 Enteroendocrine Cell That Is Argyrophilic And Stores Vasoactive Intestinal Polypeptide.
CL:0002502	type M enteroendocrine cell	An Enteroendocrine Cell Of The Small Intestine That Secretes Motilin.	type M enteroendocrine cell An Enteroendocrine Cell Of The Small Intestine That Secretes Motilin.
CL:0002503	adventitial cell	A Cell Of The Adventitial Layer Of Ductal Structures Such As The Uterer, Defent Duct, Biliary Duct, Etc	adventitial cell A Cell Of The Adventitial Layer Of Ductal Structures Such As The Uterer, Defent Duct, Biliary Duct, Etc
CL:0002504	enteric smooth muscle cell	A Smooth Muscle Cell Of The Intestine.	enteric smooth muscle cell A Smooth Muscle Cell Of The Intestine.
CL:0002505	liver CD103-negative dendritic cell	A Cd11B-Positive Dendritic Cell That Is Cd11B-High, Cd45-Positive, Mhc-Ii-Positive And Cd103-Negative.	liver CD103-negative dendritic cell A Cd11B-Positive Dendritic Cell That Is Cd11B-High, Cd45-Positive, Mhc-Ii-Positive And Cd103-Negative.
CL:0002506	liver CD103-positive dendritic cell	A Cd11B-Positive Dendritic Cell That Is Cd11B-Low, Cd45-Positive, Mhc-Ii-High And Cd103-Positive That Is Located In The Liver.	liver CD103-positive dendritic cell A Cd11B-Positive Dendritic Cell That Is Cd11B-Low, Cd45-Positive, Mhc-Ii-High And Cd103-Positive That Is Located In The Liver.
CL:0002507	langerin-positive lymph node dendritic cell	A Dermal Dendritic Cell Isolated From Skin Draining Lymph Nodes That Is Langerin-Positive, Mhc-Ii-Positive, And Cd4-Negative And Cd8A-Negative.	langerin-positive lymph node dendritic cell A Dermal Dendritic Cell Isolated From Skin Draining Lymph Nodes That Is Langerin-Positive, Mhc-Ii-Positive, And Cd4-Negative And Cd8A-Negative.
CL:0002508	langerin-negative, CD103-negative lymph node dendritic cell	A Dermal Dendritic Cell Isolated From Skin Draining Lymph Nodes That Is Langerin-Negative, Mhc-Ii-Positive, And Cd4-Negative And Cd8A-Negative.	langerin-negative, CD103-negative lymph node dendritic cell A Dermal Dendritic Cell Isolated From Skin Draining Lymph Nodes That Is Langerin-Negative, Mhc-Ii-Positive, And Cd4-Negative And Cd8A-Negative.
CL:0002509	CD103-positive, langerin-positive lymph node dendritic cell	A Langerin-Positive Lymph Node Dendritic Cell That Is Cd103-Positive And Cd11B-Low.	CD103-positive, langerin-positive lymph node dendritic cell A Langerin-Positive Lymph Node Dendritic Cell That Is Cd103-Positive And Cd11B-Low.
CL:0002510	CD103-negative, langerin-positive lymph node dendritic cell	A Langerin-Positive Lymph Node Dendritic Cell That Is Cd103-Negative And Cd11B-High.	CD103-negative, langerin-positive lymph node dendritic cell A Langerin-Positive Lymph Node Dendritic Cell That Is Cd103-Negative And Cd11B-High.
CL:0002511	CD11b-low, CD103-negative, langerin-negative lymph node dendritic cell	A Langerin-Negative Lymph Node Dendritic Cell That Is Cd103-Negative And Cd11B-Low.	CD11b-low, CD103-negative, langerin-negative lymph node dendritic cell A Langerin-Negative Lymph Node Dendritic Cell That Is Cd103-Negative And Cd11B-Low.
CL:0002512	CD11b-high, CD103-negative, langerin-negative lymph node dendritic cell	A Langerin-Negative Lymph Node Dendritic Cell That Is Cd103-Negative And Cd11B-High.	CD11b-high, CD103-negative, langerin-negative lymph node dendritic cell A Langerin-Negative Lymph Node Dendritic Cell That Is Cd103-Negative And Cd11B-High.
CL:0002513	Vgamma5-positive CD8alpha alpha positive gamma-delta intraepithelial T cell	A Cd8Alpha Alpha Positive Gamma-Delta Intraepithelial T Cell That Expresses A Tcr Encoded In Part By The Vgamma5 Gene Segment.	Vgamma5-positive CD8alpha alpha positive gamma-delta intraepithelial T cell A Cd8Alpha Alpha Positive Gamma-Delta Intraepithelial T Cell That Expresses A Tcr Encoded In Part By The Vgamma5 Gene Segment.
CL:0002514	Vgamma5-negative CD8alpha alpha positive gamma-delta intraepithelial T cell	A Cd8Alpha Alpha Positive Gamma-Delta Intraepithelial T Cell That Does Not Express A Tcr Partially Encoded By The Vgamma5 Gene Segment.	Vgamma5-negative CD8alpha alpha positive gamma-delta intraepithelial T cell A Cd8Alpha Alpha Positive Gamma-Delta Intraepithelial T Cell That Does Not Express A Tcr Partially Encoded By The Vgamma5 Gene Segment.
CL:0002515	interrenal norepinephrine type cell	An Interrenal Chromaffin Cell Found In Teleosts That Contain Heterogeneous Vesicles With Electron-Dense Granules Located Asymmetrically Within The Vesicular Membrane.	interrenal norepinephrine type cell An Interrenal Chromaffin Cell Found In Teleosts That Contain Heterogeneous Vesicles With Electron-Dense Granules Located Asymmetrically Within The Vesicular Membrane.
CL:0002516	interrenal chromaffin cell	A Chromaffin Cell Interspersed Among The Interrenal Epithelial Layer Of The Anterior Kidney Of Teloest Fish.	interrenal chromaffin cell A Chromaffin Cell Interspersed Among The Interrenal Epithelial Layer Of The Anterior Kidney Of Teloest Fish.
CL:0002517	interrenal epinephrin secreting cell	An Interrenal Chromaffin Cell Found In Teleosts That Contain Small, Homogeneous Electron-Lucent Granules That Are Separated From The Vesicular Membrane By A Visible Halo.	interrenal epinephrin secreting cell An Interrenal Chromaffin Cell Found In Teleosts That Contain Small, Homogeneous Electron-Lucent Granules That Are Separated From The Vesicular Membrane By A Visible Halo.
CL:0002518	kidney epithelial cell	An Epithelial Cell Of The Kidney.	kidney epithelial cell An Epithelial Cell Of The Kidney.
CL:0002519	interrenal epithelial cell	An Interrenal Epithelial Kidney Cell Is An Epithelial Cell Found In The Anterior Kidney Of Teleosts Fish. This Cell Type Is Arranged In Layers Around The Posterior Cardinal Vein And Contains Many Mitochondria With Tubulovesicular Cristae. Interrenal Chromaffin Cells Are Interspersed Among The Tissue Layer Created By This Cell Type.	interrenal epithelial cell An Interrenal Epithelial Kidney Cell Is An Epithelial Cell Found In The Anterior Kidney Of Teleosts Fish. This Cell Type Is Arranged In Layers Around The Posterior Cardinal Vein And Contains Many Mitochondria With Tubulovesicular Cristae. Interrenal Chromaffin Cells Are Interspersed Among The Tissue Layer Created By This Cell Type.
CL:0002520	nephrocyte	An Insect Excretory Cell That Regulates Haemolymph Composition By Filtration And Filtrate Endocytosis.	nephrocyte An Insect Excretory Cell That Regulates Haemolymph Composition By Filtration And Filtrate Endocytosis.
CL:0002521	subcutaneous fat cell	A Fat Cell That Is Part Of Subcutaneous Adipose Tissue.	subcutaneous fat cell A Fat Cell That Is Part Of Subcutaneous Adipose Tissue.
CL:0002522	renal filtration cell	A Renal Filtration Cell Is A Specialized Cell Of The Renal System That Filter Fluids By Charge, Size Or Both.	renal filtration cell A Renal Filtration Cell Is A Specialized Cell Of The Renal System That Filter Fluids By Charge, Size Or Both.
CL:0002523	mesonephric glomerular visceral epithelial cell	"A Mesonephric Glomerular Visceral Epithelial Cell Is A Specialized Epithelial Cell That Contains ""Feet"" That Interdigitate With The ""Feet"" Of Other Glomerular Epithelial Cells In The Mesonephros"	"mesonephric glomerular visceral epithelial cell A Mesonephric Glomerular Visceral Epithelial Cell Is A Specialized Epithelial Cell That Contains ""Feet"" That Interdigitate With The ""Feet"" Of Other Glomerular Epithelial Cells In The Mesonephros"
CL:0002524	disseminated nephrocyte	A Disseminated Nephrocyte Is A Nephrocyte That Filters Hemolymph And Is Found At Scattered Locations In The Fat Body Or Other Tissues.	disseminated nephrocyte A Disseminated Nephrocyte Is A Nephrocyte That Filters Hemolymph And Is Found At Scattered Locations In The Fat Body Or Other Tissues.
CL:0002525	metanephric glomerular visceral epithelial cell	"A Metanephric Glomerular Visceral Epithelial Cell Is A Specialized Epithelial Cell That Contains ""Feet"" That Interdigitate With The ""Feet"" Of Other Glomerular Epithelial Cells In The Metanephros."	"metanephric glomerular visceral epithelial cell A Metanephric Glomerular Visceral Epithelial Cell Is A Specialized Epithelial Cell That Contains ""Feet"" That Interdigitate With The ""Feet"" Of Other Glomerular Epithelial Cells In The Metanephros."
CL:0002526	CD14-positive dermal dendritic cell	A Dermal Dendritic Cell That Is Cd1A-Negative And Cd14-Positive.	CD14-positive dermal dendritic cell A Dermal Dendritic Cell That Is Cd1A-Negative And Cd14-Positive.
CL:0002527	immature CD14-positive dermal dendritic cell	An Immature Cd14-Positive Dermal Dendritic Cell Is Cd80-Low, Cd86-Low, And Mhcii-Low.	immature CD14-positive dermal dendritic cell An Immature Cd14-Positive Dermal Dendritic Cell Is Cd80-Low, Cd86-Low, And Mhcii-Low.
CL:0002528	mature CD14-positive dermal dendritic cell	A Mature Cd14-Positive Dermal Dendritic Cell Is Cd80-High, Cd86-High, Mhcii-High And Is Cd83-Positive.	mature CD14-positive dermal dendritic cell A Mature Cd14-Positive Dermal Dendritic Cell Is Cd80-High, Cd86-High, Mhcii-High And Is Cd83-Positive.
CL:0002529	CD1a-positive dermal dendritic cell	A Dermal Dendritic Cell That Is Cd1A-Positive And Cd14-Negative.	CD1a-positive dermal dendritic cell A Dermal Dendritic Cell That Is Cd1A-Positive And Cd14-Negative.
CL:0002530	immature CD1a-positive dermal dendritic cell	An Immature Cd1A-Positive Dermal Dendritic Cell Is Cd80-Low, Cd86-Low, And Mhcii-Low.	immature CD1a-positive dermal dendritic cell An Immature Cd1A-Positive Dermal Dendritic Cell Is Cd80-Low, Cd86-Low, And Mhcii-Low.
CL:0002531	mature CD1a-positive dermal dendritic cell	A Mature Cd1A-Positive Dermal Dendritic Cell Is Cd80-High, Cd83-Positive, Cd86-High, And Mhcii-High.	mature CD1a-positive dermal dendritic cell A Mature Cd1A-Positive Dermal Dendritic Cell Is Cd80-High, Cd83-Positive, Cd86-High, And Mhcii-High.
CL:0002532	CD16-positive myeloid dendritic cell	A Myeloid Dendritic Cell Found In The Blood That Is Cd16-Positive.	CD16-positive myeloid dendritic cell A Myeloid Dendritic Cell Found In The Blood That Is Cd16-Positive.
CL:0002533	immature CD16-positive myeloid dendritic cell	An Immature Cd16-Positive Myeloid Dendritic Cell Is Cd80-Low, Cd86-Low, And Mhcii-Low.	immature CD16-positive myeloid dendritic cell An Immature Cd16-Positive Myeloid Dendritic Cell Is Cd80-Low, Cd86-Low, And Mhcii-Low.
CL:0002534	mature CD16-positive myeloid dendritic cell	A Mature Cd16-Positive Myeloid Dendritic Cell Is Cd80-High, Cd83-Positive, Cd86-High, And Mhcii-High.	mature CD16-positive myeloid dendritic cell A Mature Cd16-Positive Myeloid Dendritic Cell Is Cd80-High, Cd83-Positive, Cd86-High, And Mhcii-High.
CL:0002535	epithelial cell of cervix	An Epithelial Cell Of The Cervix.	epithelial cell of cervix An Epithelial Cell Of The Cervix.
CL:0002536	epithelial cell of amnion	An Epithelial Cell That Is Part Of The Amnion.	epithelial cell of amnion An Epithelial Cell That Is Part Of The Amnion.
CL:0002537	amnion mesenchymal stem cell	A Mesenchymal Stem Cell Of The Amnion Membrane.	amnion mesenchymal stem cell A Mesenchymal Stem Cell Of The Amnion Membrane.
CL:0002538	intrahepatic bile duct epithelial cell	An Epithelial Cell Of The Intrahepatic Portion Of The Bile Duct.	intrahepatic bile duct epithelial cell An Epithelial Cell Of The Intrahepatic Portion Of The Bile Duct.
CL:0002539	aortic smooth muscle cell	A Smooth Muscle Cell Of The Aorta.	aortic smooth muscle cell A Smooth Muscle Cell Of The Aorta.
CL:0002540	mesenchymal stem cell of the bone marrow	A Mesenchymal Stem Cell That Is Part Of The Bone Marrow.	mesenchymal stem cell of the bone marrow A Mesenchymal Stem Cell That Is Part Of The Bone Marrow.
CL:0002541	chorionic membrane mesenchymal stem cell	A Mesenchymal Stem Cell Of The Chorionic Membrane.	chorionic membrane mesenchymal stem cell A Mesenchymal Stem Cell Of The Chorionic Membrane.
CL:0002543	vein endothelial cell	An Endothelial Cell That Is Part Of The Vein.	vein endothelial cell An Endothelial Cell That Is Part Of The Vein.
CL:0002544	aortic endothelial cell	An Arterial Endothelial Cell That Is Part Of The Aorta Endothelium.	aortic endothelial cell An Arterial Endothelial Cell That Is Part Of The Aorta Endothelium.
CL:0002545	thoracic aorta endothelial cell	An Endothelial Cell That Is Part Of The Thoracic Endothelium.	thoracic aorta endothelial cell An Endothelial Cell That Is Part Of The Thoracic Endothelium.
CL:0002546	embryonic blood vessel endothelial progenitor cell	An Endothelial Progenitor Cell That Participates In Angiogenesis During Development.	embryonic blood vessel endothelial progenitor cell An Endothelial Progenitor Cell That Participates In Angiogenesis During Development.
CL:0002547	fibroblast of the aortic adventitia	A Fibroblast Of The Aortic Adventitia.	fibroblast of the aortic adventitia A Fibroblast Of The Aortic Adventitia.
CL:0002548	fibroblast of cardiac tissue	A Fibroblast That Is Part Of The Heart.	fibroblast of cardiac tissue A Fibroblast That Is Part Of The Heart.
CL:0002549	fibroblast of choroid plexus	A Fibroblast That Is Part Of The Choroid Plexus.	fibroblast of choroid plexus A Fibroblast That Is Part Of The Choroid Plexus.
CL:0002550	fibroblast of the conjunctiva	A Fibroblast That Is Part Of The Conjuctiva Of The Eye.	fibroblast of the conjunctiva A Fibroblast That Is Part Of The Conjuctiva Of The Eye.
CL:0002551	fibroblast of dermis		fibroblast of dermis
CL:0002552	fibroblast of gingiva		fibroblast of gingiva
CL:0002553	fibroblast of lung	A Fibroblast That Is Part Of Lung.	fibroblast of lung A Fibroblast That Is Part Of Lung.
CL:0002554	fibroblast of lymphatic vessel	A Fibroblast Of The Lymphatic System.	fibroblast of lymphatic vessel A Fibroblast Of The Lymphatic System.
CL:0002555	fibroblast of mammary gland	A Fibroblast That Is Part Of The Mammary Gland.	fibroblast of mammary gland A Fibroblast That Is Part Of The Mammary Gland.
CL:0002556	fibroblast of periodontium	A Fibroblast Of The Periodontium.	fibroblast of periodontium A Fibroblast Of The Periodontium.
CL:0002557	fibroblast of pulmonary artery	A Fibroblast Of Pulmonary Artery.	fibroblast of pulmonary artery A Fibroblast Of Pulmonary Artery.
CL:0002558	fibroblast of villous mesenchyme	A Fibroblast That Is Part Of Villous Mesenchyme.	fibroblast of villous mesenchyme A Fibroblast That Is Part Of Villous Mesenchyme.
CL:0002559	hair follicle cell	An Animal Cell That Is Part Of A Hair Follicle.	hair follicle cell An Animal Cell That Is Part Of A Hair Follicle.
CL:0002560	inner root sheath cell	An Epithelial Cell That Resides In The Inner Root Sheath Of The Hair Follicle.	inner root sheath cell An Epithelial Cell That Resides In The Inner Root Sheath Of The Hair Follicle.
CL:0002561	outer root sheath cell	An Epithelial Cell That Is Part Of The Outer Root Sheath.	outer root sheath cell An Epithelial Cell That Is Part Of The Outer Root Sheath.
CL:0002562	hair germinal matrix cell	An Epidermal Cell That Is Part Of The Germinal Matrix.	hair germinal matrix cell An Epidermal Cell That Is Part Of The Germinal Matrix.
CL:0002563	intestinal epithelial cell	An Epithelial Cell Of The Intestine.	intestinal epithelial cell An Epithelial Cell Of The Intestine.
CL:0002564	nucleus pulposus cell of intervertebral disc	A Connective Tissue Cell Of The Nucleus Pulposus Cell Of Intervertebral Disc.	nucleus pulposus cell of intervertebral disc A Connective Tissue Cell Of The Nucleus Pulposus Cell Of Intervertebral Disc.
CL:0002565	iris pigment epithelial cell	A Pigment Cell Located In The Epithelium Of The Iris.	iris pigment epithelial cell A Pigment Cell Located In The Epithelium Of The Iris.
CL:0002566	dark melanocyte	A Melanocyte That Appears Darker Due To Content Or Amount Of Melanin Granules.	dark melanocyte A Melanocyte That Appears Darker Due To Content Or Amount Of Melanin Granules.
CL:0002567	light melanocyte	A Melanocyte That Appears Lighter In Color.	light melanocyte A Melanocyte That Appears Lighter In Color.
CL:0002568	mesenchymal stem cell of Wharton's jelly	A Mesenchymal Stem Cell That Is Part Of Wharton'S Jelly.	mesenchymal stem cell of Wharton's jelly A Mesenchymal Stem Cell That Is Part Of Wharton'S Jelly.
CL:0002569	mesenchymal stem cell of umbilical cord	A Mesenchymal Stem Cell Of The Umbilical Cord.	mesenchymal stem cell of umbilical cord A Mesenchymal Stem Cell Of The Umbilical Cord.
CL:0002570	mesenchymal stem cell of adipose	A Mesenchymal Stem Cell Of Adipose Tissue.	mesenchymal stem cell of adipose A Mesenchymal Stem Cell Of Adipose Tissue.
CL:0002571	hepatic mesenchymal stem cell	A Mesenchymal Stem Cell Of Liver.	hepatic mesenchymal stem cell A Mesenchymal Stem Cell Of Liver.
CL:0002572	vertebral mesenchymal stem cell	A Mesenchymal Stem Cell Of The Vertebrae.	vertebral mesenchymal stem cell A Mesenchymal Stem Cell Of The Vertebrae.
CL:0002573	Schwann cell	A Glial Cell That Ensheathes Axons Of Neuron In The Peripheral Nervous System And Are Necessary For Their Maintainance And Function.	Schwann cell A Glial Cell That Ensheathes Axons Of Neuron In The Peripheral Nervous System And Are Necessary For Their Maintainance And Function.
CL:0002574	stromal cell of pancreas	A Stromal Cell Of The Pancreas.	stromal cell of pancreas A Stromal Cell Of The Pancreas.
CL:0002575	central nervous system pericyte	A Pericyte Of The Central Nervous System.	central nervous system pericyte A Pericyte Of The Central Nervous System.
CL:0002576	perineural cell	A Myofibroblast That Lies In The Connective Tissue Of The Spinal Cord That Has A Distinctly Lamellar Arrangement.	perineural cell A Myofibroblast That Lies In The Connective Tissue Of The Spinal Cord That Has A Distinctly Lamellar Arrangement.
CL:0002577	placental epithelial cell	An Epithelial Cell Of The Placenta.	placental epithelial cell An Epithelial Cell Of The Placenta.
CL:0002578	mesenteric preadipocyte	A Preadipocyte Found In Mesenteric Tissue.	mesenteric preadipocyte A Preadipocyte Found In Mesenteric Tissue.
CL:0002579	omentum preadipocyte		omentum preadipocyte
CL:0002580	preadipocyte of the breast	A Preadipocyte That Is Part Of The Breast.	preadipocyte of the breast A Preadipocyte That Is Part Of The Breast.
CL:0002581	perirenal preadipocyte		perirenal preadipocyte
CL:0002582	visceral preadipocyte	A Preadipocyte That Is Part Of Visceral Tissue.	visceral preadipocyte A Preadipocyte That Is Part Of Visceral Tissue.
CL:0002583	subcutaneous preadipocyte	A Preadipocyte That Is Part Of Subcutaneous Tissue.	subcutaneous preadipocyte A Preadipocyte That Is Part Of Subcutaneous Tissue.
CL:0002584	renal cortical epithelial cell	An Epithelial Cell Of The Kidney Cortex.	renal cortical epithelial cell An Epithelial Cell Of The Kidney Cortex.
CL:0002585	retinal blood vessel endothelial cell	A Blood Vessel Endothelial Cell That Is Part Of The Retina.	retinal blood vessel endothelial cell A Blood Vessel Endothelial Cell That Is Part Of The Retina.
CL:0002586	retinal pigment epithelial cell	An Epithelial Cell Of The Retinal Pigmented Epithelium.	retinal pigment epithelial cell An Epithelial Cell Of The Retinal Pigmented Epithelium.
CL:0002588	smooth muscle cell of the umbilical vein	A Smooth Muscle Cell Of The Umbilical Vein.	smooth muscle cell of the umbilical vein A Smooth Muscle Cell Of The Umbilical Vein.
CL:0002589	smooth muscle cell of the brachiocephalic vasculature	A Smooth Muscle Cell Of The Bachiocephalic Vasculature.	smooth muscle cell of the brachiocephalic vasculature A Smooth Muscle Cell Of The Bachiocephalic Vasculature.
CL:0002590	smooth muscle cell of the brain vasculature	A Vascular Associated Smooth Muscle Cell Of The Brain Vasculature.	smooth muscle cell of the brain vasculature A Vascular Associated Smooth Muscle Cell Of The Brain Vasculature.
CL:0002591	smooth muscle cell of the pulmonary artery	A Smooth Muscle Of The Pulmonary Artery.	smooth muscle cell of the pulmonary artery A Smooth Muscle Of The Pulmonary Artery.
CL:0002592	smooth muscle cell of the coronary artery	A Smooth Muscle Cell Of The Coronary Artery.	smooth muscle cell of the coronary artery A Smooth Muscle Cell Of The Coronary Artery.
CL:0002593	smooth muscle cell of the internal thoracic artery	A Smooth Muscle Of The Internal Thoracic Artery.	smooth muscle cell of the internal thoracic artery A Smooth Muscle Of The Internal Thoracic Artery.
CL:0002594	smooth muscle cell of the umbilical artery	A Smooth Muscle Cell Of The Umbilical Artery.	smooth muscle cell of the umbilical artery A Smooth Muscle Cell Of The Umbilical Artery.
CL:0002595	smooth muscle cell of the subclavian artery	A Smooth Muscle Cell Of The Subclavian Artery.	smooth muscle cell of the subclavian artery A Smooth Muscle Cell Of The Subclavian Artery.
CL:0002596	smooth muscle cell of the carotid artery	Smooth Muscle Cell Of The Carotid Artery.	smooth muscle cell of the carotid artery Smooth Muscle Cell Of The Carotid Artery.
CL:0002597	smooth muscle cell of bladder	A Smooth Muscle Cell Of The Bladder.	smooth muscle cell of bladder A Smooth Muscle Cell Of The Bladder.
CL:0002598	bronchial smooth muscle cell		bronchial smooth muscle cell
CL:0002599	smooth muscle cell of the esophagus	A Smooth Muscle Cell Of The Esophagus.	smooth muscle cell of the esophagus A Smooth Muscle Cell Of The Esophagus.
CL:0002600	smooth muscle cell of trachea	A Smooth Muscle Cell Of The Trachea.	smooth muscle cell of trachea A Smooth Muscle Cell Of The Trachea.
CL:0002601	uterine smooth muscle cell	A Smooth Muscle Cell Of The Uterus.	uterine smooth muscle cell A Smooth Muscle Cell Of The Uterus.
CL:0002602	annulus pulposus cell		annulus pulposus cell
CL:0002603	astrocyte of the cerebellum	An Astrocyte Of The Cerebellum.	astrocyte of the cerebellum An Astrocyte Of The Cerebellum.
CL:0002604	astrocyte of the hippocampus		astrocyte of the hippocampus
CL:0002605	astrocyte of the cerebral cortex	An Astrocyte Of The Cerebral Cortex.	astrocyte of the cerebral cortex An Astrocyte Of The Cerebral Cortex.
CL:0002606	astrocyte of the spinal cord	An Astrocyte Of The Spinal Cord.	astrocyte of the spinal cord An Astrocyte Of The Spinal Cord.
CL:0002607	migratory enteric neural crest cell	A Neural Crest Cell That Gives Rise To Cells Of The Enteric Nervous System.	migratory enteric neural crest cell A Neural Crest Cell That Gives Rise To Cells Of The Enteric Nervous System.
CL:0002608	hippocampal neuron	A Neuron Of The Hippocampus.	hippocampal neuron A Neuron Of The Hippocampus.
CL:0002609	neuron of cerebral cortex	A Cns Neuron Of The Cerebral Cortex.	neuron of cerebral cortex A Cns Neuron Of The Cerebral Cortex.
CL:0002610	raphe nuclei neuron	A Neuron Of The Raphe Nuclei.	raphe nuclei neuron A Neuron Of The Raphe Nuclei.
CL:0002611	neuron of the dorsal spinal cord	A Cns Neuron Of The Dorsal Spinal Cord.	neuron of the dorsal spinal cord A Cns Neuron Of The Dorsal Spinal Cord.
CL:0002612	neuron of the ventral spinal cord	A Neuron Of The Ventral Spinal Cord.	neuron of the ventral spinal cord A Neuron Of The Ventral Spinal Cord.
CL:0002613	striatum neuron	A Neuron Of The Striatum.	striatum neuron A Neuron Of The Striatum.
CL:0002614	neuron of the substantia nigra	A Neuron Of The Substantia Nigra.	neuron of the substantia nigra A Neuron Of The Substantia Nigra.
CL:0002615	adipocyte of omentum tissue	A Fat Cell That Is Part Of Omentum Tissue.	adipocyte of omentum tissue A Fat Cell That Is Part Of Omentum Tissue.
CL:0002616	perirenal adipocyte cell	A Fat Cell Of Perirenal Fat Tissue.	perirenal adipocyte cell A Fat Cell Of Perirenal Fat Tissue.
CL:0002617	adipocyte of breast	A Fat Cell That Is Part Of The Breast.	adipocyte of breast A Fat Cell That Is Part Of The Breast.
CL:0002618	endothelial cell of umbilical vein	An Endothelial Cell Of The Umbilical Vein.	endothelial cell of umbilical vein An Endothelial Cell Of The Umbilical Vein.
CL:0002619	adult endothelial progenitor cell	An Adult Angioblastic Cell Released From The Bone Marrow, Capable Of Blood Circulation And Participation In Angiogenesis By Differentiating Into Blood Vessel Endothelial Cells. Their Existence Is Controversial.	adult endothelial progenitor cell An Adult Angioblastic Cell Released From The Bone Marrow, Capable Of Blood Circulation And Participation In Angiogenesis By Differentiating Into Blood Vessel Endothelial Cells. Their Existence Is Controversial.
CL:0002620	skin fibroblast	A Fibroblast Of Skin.	skin fibroblast A Fibroblast Of Skin.
CL:0002621	gingival epithelial cell		gingival epithelial cell
CL:0002622	prostate stromal cell	A Stromal Cell Of The Prostate.	prostate stromal cell A Stromal Cell Of The Prostate.
CL:0002623	acinar cell of salivary gland	An Acinar Cell Of Salivary Gland.	acinar cell of salivary gland An Acinar Cell Of Salivary Gland.
CL:0002624	paneth cell of the appendix	A Paneth Cell Of The Appendix.	paneth cell of the appendix A Paneth Cell Of The Appendix.
CL:0002625	seminiferous tubule epithelial cell	A Cell Of The Seminiferous Tubule Epithelium.	seminiferous tubule epithelial cell A Cell Of The Seminiferous Tubule Epithelium.
