ID	cell_name	defination	description
CL:0000000	cell	A Material Entity Of Anatomical Origin (Part Of Or Deriving From An Organism) That Has As Its Parts A Maximally Connected Cell Compartment Surrounded By A Plasma Membrane.	cell A Material Entity Of Anatomical Origin (Part Of Or Deriving From An Organism) That Has As Its Parts A Maximally Connected Cell Compartment Surrounded By A Plasma Membrane.
CL:0000001	primary cultured cell	A Cultured Cell That Is Freshly Isolated From A Organismal Source, Or Derives In Culture From Such A Cell Prior To The Culture Being Passaged.	primary cultured cell A Cultured Cell That Is Freshly Isolated From A Organismal Source, Or Derives In Culture From Such A Cell Prior To The Culture Being Passaged.
CL:0000002	obsolete immortal cell line cell	Obsolete: A Cell Line Cell That Is Expected To Be Capable Of An Unlimited Number Of Divisions, And Is Thus Able To Support Indefinite Growth/Propagation In Vitro As Part Of A Immortal Cell Line.	obsolete immortal cell line cell Obsolete: A Cell Line Cell That Is Expected To Be Capable Of An Unlimited Number Of Divisions, And Is Thus Able To Support Indefinite Growth/Propagation In Vitro As Part Of A Immortal Cell Line.
CL:0000003	native cell	A Cell That Is Found In A Natural Setting, Which Includes Multicellular Organism Cells 'In Vivo' (I.E. Part Of An Organism), And Unicellular Organisms 'In Environment' (I.E. Part Of A Natural Environment).	native cell A Cell That Is Found In A Natural Setting, Which Includes Multicellular Organism Cells 'In Vivo' (I.E. Part Of An Organism), And Unicellular Organisms 'In Environment' (I.E. Part Of A Natural Environment).
CL:0000004	obsolete cell by organism	Obsolete: A Classification Of Cells By The Organisms Within Which They Are Contained.	obsolete cell by organism Obsolete: A Classification Of Cells By The Organisms Within Which They Are Contained.
CL:0000005	fibroblast neural crest derived		fibroblast neural crest derived
CL:0000006	neuronal receptor cell		neuronal receptor cell
CL:0000007	early embryonic cell	A Cell Found In The Embryo Before The Formation Of All The Gem Layers Is Complete.	early embryonic cell A Cell Found In The Embryo Before The Formation Of All The Gem Layers Is Complete.
CL:0000008	migratory cranial neural crest cell		migratory cranial neural crest cell
CL:0000009	obsolete fusiform initial	Obsolete. Use Po:0000079 From Plant Ontology Instead. An Elongated Cell With Approximately Wedge-Shaped Ends, Found In The Vascular Cambium, Which Gives Rise To The Elements Of The Axial System In The Secondary Vascular Tissues.	obsolete fusiform initial Obsolete. Use Po:0000079 From Plant Ontology Instead. An Elongated Cell With Approximately Wedge-Shaped Ends, Found In The Vascular Cambium, Which Gives Rise To The Elements Of The Axial System In The Secondary Vascular Tissues.
CL:0000010	cultured cell	A Cell In Vitro That Is Or Has Been Maintained Or Propagated As Part Of A Cell Culture.	cultured cell A Cell In Vitro That Is Or Has Been Maintained Or Propagated As Part Of A Cell Culture.
CL:0000011	migratory trunk neural crest cell		migratory trunk neural crest cell
CL:0000012	obsolete cell by class		obsolete cell by class
CL:0000013	obsolete dentine secreting cell		obsolete dentine secreting cell
CL:0000014	germ line stem cell		germ line stem cell
CL:0000015	male germ cell		male germ cell
CL:0000016	male germ line stem cell		male germ line stem cell
CL:0000017	spermatocyte	A Male Germ Cell That Develops From Spermatogonia. The Euploid Primary Spermatocytes Undergo Meiosis And Give Rise To The Haploid Secondary Spermatocytes Which In Turn Give Rise To Spermatids.	spermatocyte A Male Germ Cell That Develops From Spermatogonia. The Euploid Primary Spermatocytes Undergo Meiosis And Give Rise To The Haploid Secondary Spermatocytes Which In Turn Give Rise To Spermatids.
CL:0000018	spermatid	A Male Germ Cell That Develops From The Haploid Secondary Spermatocytes. Without Further Division, Spermatids Undergo Structural Changes And Give Rise To Spermatozoa.	spermatid A Male Germ Cell That Develops From The Haploid Secondary Spermatocytes. Without Further Division, Spermatids Undergo Structural Changes And Give Rise To Spermatozoa.
CL:0000019	sperm	A Mature Male Germ Cell That Develops From A Spermatid.	sperm A Mature Male Germ Cell That Develops From A Spermatid.
CL:0000020	spermatogonium	An Euploid Male Germ Cell Of An Early Stage Of Spermatogenesis.	spermatogonium An Euploid Male Germ Cell Of An Early Stage Of Spermatogenesis.
CL:0000021	female germ cell	Female Germ Cell Is A Germ Cell That Supports Female Gamete Production.	female germ cell Female Germ Cell Is A Germ Cell That Supports Female Gamete Production.
CL:0000022	female germ line stem cell		female germ line stem cell
CL:0000023	oocyte	A Female Germ Cell That Has Entered Meiosis.	oocyte A Female Germ Cell That Has Entered Meiosis.
CL:0000024	oogonial cell	An Undifferentiated Germ Cell That Proliferates Rapidly And Gives Rise To Oocytes.	oogonial cell An Undifferentiated Germ Cell That Proliferates Rapidly And Gives Rise To Oocytes.
CL:0000025	egg cell	A Female Gamete Where Meiosis Has Progressed To Metaphase Ii And Is Able To Participate In Fertilization.	egg cell A Female Gamete Where Meiosis Has Progressed To Metaphase Ii And Is Able To Participate In Fertilization.
CL:0000026	invertebrate nurse cell	A Germline Cell That Contributes To The Development Of The Oocyte By Transferring Cytoplasm Directly To Oocyte.	invertebrate nurse cell A Germline Cell That Contributes To The Development Of The Oocyte By Transferring Cytoplasm Directly To Oocyte.
CL:0000027	smooth muscle cell neural crest derived		smooth muscle cell neural crest derived
CL:0000028	CNS neuron (sensu Nematoda and Protostomia)		CNS neuron (sensu Nematoda and Protostomia)
CL:0000029	neuron neural crest derived		neuron neural crest derived
CL:0000030	glioblast		glioblast
CL:0000031	neuroblast	A Cell That Will Develop Into A Neuron Often After A Migration Phase.	neuroblast A Cell That Will Develop Into A Neuron Often After A Migration Phase.
CL:0000032	neuroplacodal cell	A Cell Of A Platelike Structure, Especially A Thickened Plate Of Ectoderm In The Early Embryo, From Which A Sense Organ Develops.	neuroplacodal cell A Cell Of A Platelike Structure, Especially A Thickened Plate Of Ectoderm In The Early Embryo, From Which A Sense Organ Develops.
CL:0000033	apocrine cell	An Apocrine Cell Is A Secretory Cell Characterized Loss Of Part Of The Cytoplasm During The Process Of Secretion - Secretions Are Budded Off Through The Plasma Membrane Producing Membrane Bound Vesicles Containing The Secreted Substance.	apocrine cell An Apocrine Cell Is A Secretory Cell Characterized Loss Of Part Of The Cytoplasm During The Process Of Secretion - Secretions Are Budded Off Through The Plasma Membrane Producing Membrane Bound Vesicles Containing The Secreted Substance.
CL:0000034	stem cell	A Relatively Undifferentiated Cell That Retains The Ability To Divide And Proliferate Throughout Life To Provide Progenitor Cells That Can Differentiate Into Specialized Cells.	stem cell A Relatively Undifferentiated Cell That Retains The Ability To Divide And Proliferate Throughout Life To Provide Progenitor Cells That Can Differentiate Into Specialized Cells.
CL:0000035	single fate stem cell	A Stem Cell That Self-Renews As Well As Give Rise To A Single Mature Cell Type.	single fate stem cell A Stem Cell That Self-Renews As Well As Give Rise To A Single Mature Cell Type.
CL:0000036	epithelial fate stem cell		epithelial fate stem cell
CL:0000037	hematopoietic stem cell	A Stem Cell From Which All Cells Of The Lymphoid And Myeloid Lineages Develop, Including Blood Cells And Cells Of The Immune System. Hematopoietic Stem Cells Lack Cell Markers Of Effector Cells (Lin-Negative). Lin-Negative Is Defined By Lacking One Or More Of The Following Cell Surface Markers: Cd2, Cd3 Epsilon, Cd4, Cd5 ,Cd8 Alpha Chain, Cd11B, Cd14, Cd19, Cd20, Cd56, Ly6G, Ter119.	hematopoietic stem cell A Stem Cell From Which All Cells Of The Lymphoid And Myeloid Lineages Develop, Including Blood Cells And Cells Of The Immune System. Hematopoietic Stem Cells Lack Cell Markers Of Effector Cells (Lin-Negative). Lin-Negative Is Defined By Lacking One Or More Of The Following Cell Surface Markers: Cd2, Cd3 Epsilon, Cd4, Cd5 ,Cd8 Alpha Chain, Cd11B, Cd14, Cd19, Cd20, Cd56, Ly6G, Ter119.
CL:0000038	erythroid progenitor cell	A Progenitor Cell Committed To The Erythroid Lineage.	erythroid progenitor cell A Progenitor Cell Committed To The Erythroid Lineage.
CL:0000039	germ line cell	A Cell That Is Within The Developmental Lineage Of Gametes And Is Able To Pass Along Its Genetic Material To Offspring.	germ line cell A Cell That Is Within The Developmental Lineage Of Gametes And Is Able To Pass Along Its Genetic Material To Offspring.
CL:0000040	monoblast	A Myeloid Progenitor Cell Committed To The Monocyte Lineage. This Cell Is Cd11B-Positive, Has Basophilic Cytoplasm, Euchromatin, And The Presence Of A Nucleolus.	monoblast A Myeloid Progenitor Cell Committed To The Monocyte Lineage. This Cell Is Cd11B-Positive, Has Basophilic Cytoplasm, Euchromatin, And The Presence Of A Nucleolus.
CL:0000041	mature eosinophil	A Fully Differentiated Eosinophil, A Granular Leukocyte With A Nucleus That Usually Has Two Lobes Connected By One Or More Slender Threads, And Cytoplasm Containing Coarse, Round Granules That Are Uniform In Size And Which Can Be Stained By The Dye Eosin. Cells Are Also Differentiated From Other Granulocytes By A Small Nuclear-To-Cytoplasm Ratio (1:3). This Cell Type Is Cd49D-Positive.	mature eosinophil A Fully Differentiated Eosinophil, A Granular Leukocyte With A Nucleus That Usually Has Two Lobes Connected By One Or More Slender Threads, And Cytoplasm Containing Coarse, Round Granules That Are Uniform In Size And Which Can Be Stained By The Dye Eosin. Cells Are Also Differentiated From Other Granulocytes By A Small Nuclear-To-Cytoplasm Ratio (1:3). This Cell Type Is Cd49D-Positive.
CL:0000042	neutrophilic myeloblast	A Myeloblast Committed To The Neutrophil Lineage. This Cell Type Is Gata-1 Positive, C/Ebpa-Positive, Aml-1-Positive, C-Myb-Positive And Has Low Expression Of Pu.1 Transcription Factor.	neutrophilic myeloblast A Myeloblast Committed To The Neutrophil Lineage. This Cell Type Is Gata-1 Positive, C/Ebpa-Positive, Aml-1-Positive, C-Myb-Positive And Has Low Expression Of Pu.1 Transcription Factor.
CL:0000043	mature basophil	A Fully Differentiated Basophil, A Granular Leukocyte With An Irregularly Shaped, Pale-Staining Nucleus That Is Partially Constricted Into Two Lobes, And With Cytoplasm That Contains Coarse Granules Of Variable Size. Basophils Contain Vasoactive Amines Such As Histamine And Serotonin, Which Are Released On Appropriate Stimulation.	mature basophil A Fully Differentiated Basophil, A Granular Leukocyte With An Irregularly Shaped, Pale-Staining Nucleus That Is Partially Constricted Into Two Lobes, And With Cytoplasm That Contains Coarse Granules Of Variable Size. Basophils Contain Vasoactive Amines Such As Histamine And Serotonin, Which Are Released On Appropriate Stimulation.
CL:0000045	obsolete thymus processed stem cell	Obsolete (Was Not Defined Before Being Made Obsolete).	obsolete thymus processed stem cell Obsolete (Was Not Defined Before Being Made Obsolete).
CL:0000046	obsolete bursa processed stem cell	Obsolete (Was Not Defined Before Being Made Obsolete).	obsolete bursa processed stem cell Obsolete (Was Not Defined Before Being Made Obsolete).
CL:0000047	neuronal stem cell	Neural Stem Cell Is Characterized As An Undifferentiated Cell That Originates From The Neuroectoderm And Has The Capacity Both To Perpetually Self-Renew Without Differentiating And To Generate Multiple Types Of Lineage-Restricted Progenitors.	neuronal stem cell Neural Stem Cell Is Characterized As An Undifferentiated Cell That Originates From The Neuroectoderm And Has The Capacity Both To Perpetually Self-Renew Without Differentiating And To Generate Multiple Types Of Lineage-Restricted Progenitors.
CL:0000048	multi fate stem cell	A Stem Cell That Can Give Rise To Multiple Lineages Of Cells.	multi fate stem cell A Stem Cell That Can Give Rise To Multiple Lineages Of Cells.
CL:0000049	common myeloid progenitor	A Progenitor Cell Committed To Myeloid Lineage, Including The Megakaryocyte And Erythroid Lineages.	common myeloid progenitor A Progenitor Cell Committed To Myeloid Lineage, Including The Megakaryocyte And Erythroid Lineages.
CL:0000050	megakaryocyte-erythroid progenitor cell	A Progenitor Cell Committed To The Megakaryocyte And Erythroid Lineages.	megakaryocyte-erythroid progenitor cell A Progenitor Cell Committed To The Megakaryocyte And Erythroid Lineages.
CL:0000051	common lymphoid progenitor	A Oligopotent Progenitor Cell Committed To The Lymphoid Lineage.	common lymphoid progenitor A Oligopotent Progenitor Cell Committed To The Lymphoid Lineage.
CL:0000052	totipotent stem cell	A Stem Cell From Which All Cells Of The Body Can Form.	totipotent stem cell A Stem Cell From Which All Cells Of The Body Can Form.
CL:0000054	bone matrix secreting cell		bone matrix secreting cell
CL:0000055	non-terminally differentiated cell	A Precursor Cell With A Limited Number Of Potential Fates.	non-terminally differentiated cell A Precursor Cell With A Limited Number Of Potential Fates.
CL:0000056	myoblast	A Cell That Is Commited To Differentiating Into A Muscle Cell.  Embryonic Myoblasts Develop From The Mesoderm. They Undergo Proliferation, Migrate To Their Various Sites, And Then Differentiate Into The Appropriate Form Of Myocytes.  Myoblasts Also Occur As Transient Populations Of Cells In Muscles Undergoing Repair.	myoblast A Cell That Is Commited To Differentiating Into A Muscle Cell.  Embryonic Myoblasts Develop From The Mesoderm. They Undergo Proliferation, Migrate To Their Various Sites, And Then Differentiate Into The Appropriate Form Of Myocytes.  Myoblasts Also Occur As Transient Populations Of Cells In Muscles Undergoing Repair.
CL:0000057	fibroblast	A Connective Tissue Cell Which Secretes An Extracellular Matrix Rich In Collagen And Other Macromolecules. Flattened And Irregular In Outline With Branching Processes; Appear Fusiform Or Spindle-Shaped.	fibroblast A Connective Tissue Cell Which Secretes An Extracellular Matrix Rich In Collagen And Other Macromolecules. Flattened And Irregular In Outline With Branching Processes; Appear Fusiform Or Spindle-Shaped.
CL:0000058	chondroblast	Skeletogenic Cell That Is Typically Non-Terminally Differentiated, Secretes An Avascular, Gag Rich Matrix; Is Not Buried In Cartilage Tissue Matrix, Retains The Ability To Divide, Located Adjacent To Cartilage Tissue (Including Within The Perichondrium), And Develops From Prechondroblast (And Thus Prechondrogenic) Cell.	chondroblast Skeletogenic Cell That Is Typically Non-Terminally Differentiated, Secretes An Avascular, Gag Rich Matrix; Is Not Buried In Cartilage Tissue Matrix, Retains The Ability To Divide, Located Adjacent To Cartilage Tissue (Including Within The Perichondrium), And Develops From Prechondroblast (And Thus Prechondrogenic) Cell.
CL:0000059	ameloblast	Skeletogenic Cell That Produces Enamel, Overlies The Odontogenic Papilla, And Arises From The Differentiation Of A Preameloblast Cell.	ameloblast Skeletogenic Cell That Produces Enamel, Overlies The Odontogenic Papilla, And Arises From The Differentiation Of A Preameloblast Cell.
CL:0000060	odontoblast	Skeletogenic Cell That Secretes Dentine Matrix, Is Derived From The Odontogenic Papilla, And Develops From A Preodontoblast Cell.	odontoblast Skeletogenic Cell That Secretes Dentine Matrix, Is Derived From The Odontogenic Papilla, And Develops From A Preodontoblast Cell.
CL:0000061	cementoblast	Skeletogenic Cell That Produces Cementum (A Bony Substance That Covers The Root Of A Tooth), Is Part Of The Odontogenic Papilla, And Develops From A Precementoblast Cell.	cementoblast Skeletogenic Cell That Produces Cementum (A Bony Substance That Covers The Root Of A Tooth), Is Part Of The Odontogenic Papilla, And Develops From A Precementoblast Cell.
CL:0000062	osteoblast	Skeletogenic Cell That Secretes Osteoid, Is Capable Of Producing Mineralized (Hydroxyapatite) Matrix, Is Located Adjacent To Or Within Osteoid Tissue, And Arises From The Transformation Of A Preosteoblast Cell.	osteoblast Skeletogenic Cell That Secretes Osteoid, Is Capable Of Producing Mineralized (Hydroxyapatite) Matrix, Is Located Adjacent To Or Within Osteoid Tissue, And Arises From The Transformation Of A Preosteoblast Cell.
CL:0000063	obsolete cell by histology	Obsolete: A Classification Of Cells By Their Microscopic Appearance.	obsolete cell by histology Obsolete: A Classification Of Cells By Their Microscopic Appearance.
CL:0000064	ciliated cell	A Cell That Has A Filiform Extrusion Of The Cell Surface.	ciliated cell A Cell That Has A Filiform Extrusion Of The Cell Surface.
CL:0000065	ependymal cell	A Neurectoderm Derived Cell That Lines The Neural Lumen.	ependymal cell A Neurectoderm Derived Cell That Lines The Neural Lumen.
CL:0000066	epithelial cell	A Cell That Is Usually Found In A Two-Dimensional Sheet With A Free Surface. The Cell Has A Cytoskeleton That Allows For Tight Cell To Cell Contact And For Cell Polarity Where Apical Part Is Directed Towards The Lumen And The Basal Part To The Basal Lamina.	epithelial cell A Cell That Is Usually Found In A Two-Dimensional Sheet With A Free Surface. The Cell Has A Cytoskeleton That Allows For Tight Cell To Cell Contact And For Cell Polarity Where Apical Part Is Directed Towards The Lumen And The Basal Part To The Basal Lamina.
CL:0000067	ciliated epithelial cell	An Epithelial Cell That Has A Cilia.	ciliated epithelial cell An Epithelial Cell That Has A Cilia.
CL:0000068	duct epithelial cell		duct epithelial cell
CL:0000069	branched duct epithelial cell		branched duct epithelial cell
CL:0000070	obsolete epithelial cell of gland		obsolete epithelial cell of gland
CL:0000071	blood vessel endothelial cell	An Endothelial Cell That Lines The Vasculature.	blood vessel endothelial cell An Endothelial Cell That Lines The Vasculature.
CL:0000072	non-branched duct epithelial cell		non-branched duct epithelial cell
CL:0000073	barrier epithelial cell		barrier epithelial cell
CL:0000074	obsolete epithem cell	Obsolete. Use Po:0000066 From Plant Ontology Instead. A Cell That Constitutes The Mesophyll Of A Hydathode And Is Located Between The Xylem Endings And The Epidermis. Proposed To Be Involved In The Retrieval Of Solutes From The Xylem Sap.	obsolete epithem cell Obsolete. Use Po:0000066 From Plant Ontology Instead. A Cell That Constitutes The Mesophyll Of A Hydathode And Is Located Between The Xylem Endings And The Epidermis. Proposed To Be Involved In The Retrieval Of Solutes From The Xylem Sap.
CL:0000075	columnar/cuboidal epithelial cell		columnar/cuboidal epithelial cell
CL:0000076	squamous epithelial cell		squamous epithelial cell
CL:0000077	mesothelial cell	A Flattened Epithelial Cell Of Mesenchymal Origin That Lines The Serous Cavity.	mesothelial cell A Flattened Epithelial Cell Of Mesenchymal Origin That Lines The Serous Cavity.
CL:0000078	peridermal cell		peridermal cell
CL:0000079	stratified epithelial cell		stratified epithelial cell
CL:0000080	circulating cell	A Cell Which Moves Among Different Tissues Of The Body, Via Blood, Lymph, Or Other Medium.	circulating cell A Cell Which Moves Among Different Tissues Of The Body, Via Blood, Lymph, Or Other Medium.
CL:0000081	blood cell	A Cell Found Predominately In The Blood.	blood cell A Cell Found Predominately In The Blood.
CL:0000082	epithelial cell of lung		epithelial cell of lung
CL:0000083	epithelial cell of pancreas	An Epithelial Cell Of The Pancreas.	epithelial cell of pancreas An Epithelial Cell Of The Pancreas.
CL:0000084	T cell	A Type Of Lymphocyte Whose Defining Characteristic Is The Expression Of A T Cell Receptor Complex.	T cell A Type Of Lymphocyte Whose Defining Characteristic Is The Expression Of A T Cell Receptor Complex.
CL:0000085	germ line stem cell (sensu Vertebrata)		germ line stem cell (sensu Vertebrata)
CL:0000086	germ line stem cell (sensu Nematoda and Protostomia)		germ line stem cell (sensu Nematoda and Protostomia)
CL:0000087	male germ line stem cell (sensu Nematoda and Protostomia)		male germ line stem cell (sensu Nematoda and Protostomia)
CL:0000088	female germ line stem cell (sensu Nematoda and Protostomia)		female germ line stem cell (sensu Nematoda and Protostomia)
CL:0000089	male germ line stem cell (sensu Vertebrata)		male germ line stem cell (sensu Vertebrata)
CL:0000090	female germ line stem cell (sensu Vertebrata)		female germ line stem cell (sensu Vertebrata)
CL:0000091	Kupffer cell	A Tissue-Resident Macrophage Of The Reticuloendothelial System Found On The Luminal Surface Of The Hepatic Sinusoids Involved In Erythrocyte Clearance. Markers Include F4/80+, Cd11B-Low, Cd68-Positive, Sialoadhesin-Positive, Cd163/Srcr-Positive. Irregular, With Long Processes Including Lamellipodia Extending Into The Sinusoid Lumen, Have Flattened Nucleus With Cytoplasm Containing Characteristic Invaginations Of The Plasma Membrane (Vermiform Bodies); Lie Within The Sinusoid Lumen Attached To The Endothelial Surface; Derived From The Bone Marrow, Form A Major Part Of The Body'S Mononuclear Phagocyte System.	Kupffer cell A Tissue-Resident Macrophage Of The Reticuloendothelial System Found On The Luminal Surface Of The Hepatic Sinusoids Involved In Erythrocyte Clearance. Markers Include F4/80+, Cd11B-Low, Cd68-Positive, Sialoadhesin-Positive, Cd163/Srcr-Positive. Irregular, With Long Processes Including Lamellipodia Extending Into The Sinusoid Lumen, Have Flattened Nucleus With Cytoplasm Containing Characteristic Invaginations Of The Plasma Membrane (Vermiform Bodies); Lie Within The Sinusoid Lumen Attached To The Endothelial Surface; Derived From The Bone Marrow, Form A Major Part Of The Body'S Mononuclear Phagocyte System.
CL:0000092	osteoclast	A Specialized Phagocytic Cell Associated With The Absorption And Removal Of The Mineralized Matrix Of Bone Tissue, Which Typically Differentiates From Monocytes. This Cell Has The Following Markers: Tartrate-Resistant Acid Phosphatase Type 5-Positive, Pu.1-Positive, C-Fos-Positive, Nuclear Factor Nf-Kappa-B P100 Subunit-Positive, Tumor Necrosis Factor Receptor Superfamily Member 11A-Positive And Macrophage Colony-Stimulating Factor 1 Receptor-Positive.	osteoclast A Specialized Phagocytic Cell Associated With The Absorption And Removal Of The Mineralized Matrix Of Bone Tissue, Which Typically Differentiates From Monocytes. This Cell Has The Following Markers: Tartrate-Resistant Acid Phosphatase Type 5-Positive, Pu.1-Positive, C-Fos-Positive, Nuclear Factor Nf-Kappa-B P100 Subunit-Positive, Tumor Necrosis Factor Receptor Superfamily Member 11A-Positive And Macrophage Colony-Stimulating Factor 1 Receptor-Positive.
CL:0000093	obsolete osteochondroclast	Obsolete (Was Not Defined Before Being Made Obsolete).	obsolete osteochondroclast Obsolete (Was Not Defined Before Being Made Obsolete).
CL:0000094	granulocyte	A Leukocyte With Abundant Granules In The Cytoplasm.	granulocyte A Leukocyte With Abundant Granules In The Cytoplasm.
CL:0000095	neuron associated cell		neuron associated cell
CL:0000096	mature neutrophil	A Fully Differentiated Neutrophil, A Granular Leukocyte Having A Nucleus With Three To Five Lobes Connected By Slender Threads, And Cytoplasm Containing Fine Inconspicuous Granules And Stainable By Neutral Dyes. They Are Produced In Bone Marrow At A Rate Of 5E10-10E10/Day And Have A Half-Life Of 6-8 Hours. Neutrophils Are Cd15-Positive, Cd16-Positive, Cd32-Positive, Cd43-Positive, Cd181-Positive, And Cd182-Positive.	mature neutrophil A Fully Differentiated Neutrophil, A Granular Leukocyte Having A Nucleus With Three To Five Lobes Connected By Slender Threads, And Cytoplasm Containing Fine Inconspicuous Granules And Stainable By Neutral Dyes. They Are Produced In Bone Marrow At A Rate Of 5E10-10E10/Day And Have A Half-Life Of 6-8 Hours. Neutrophils Are Cd15-Positive, Cd16-Positive, Cd32-Positive, Cd43-Positive, Cd181-Positive, And Cd182-Positive.
CL:0000097	mast cell	A Cell That Is Found In Almost All Tissues Containing Numerous Basophilic Granules And Capable Of Releasing Large Amounts Of Histamine And Heparin Upon Activation. Progenitors Leave Bone Marrow And Mature In Connective And Mucosal Tissue. Mature Mast Cells Are Found In All Tissues, Except The Bloodstream. Their Phenotype Is Cd117-High, Cd123-Negative, Cd193-Positive, Cd200R3-Positive, And Fceri-High. Stem-Cell Factor (Kit-Ligand; Scf) Is The Main Controlling Signal Of Their Survival And Development.	mast cell A Cell That Is Found In Almost All Tissues Containing Numerous Basophilic Granules And Capable Of Releasing Large Amounts Of Histamine And Heparin Upon Activation. Progenitors Leave Bone Marrow And Mature In Connective And Mucosal Tissue. Mature Mast Cells Are Found In All Tissues, Except The Bloodstream. Their Phenotype Is Cd117-High, Cd123-Negative, Cd193-Positive, Cd200R3-Positive, And Fceri-High. Stem-Cell Factor (Kit-Ligand; Scf) Is The Main Controlling Signal Of Their Survival And Development.
CL:0000098	sensory epithelial cell	A Specialized Epithelial Cell Involved In Sensory Perception. Restricted To Special Sense Organs Of The Olfactory, Gustatory, And Vestibulocochlear Receptor Systems; Contain Sensory Cells Surrounded By Supportive, Non-Receptive Cells.	sensory epithelial cell A Specialized Epithelial Cell Involved In Sensory Perception. Restricted To Special Sense Organs Of The Olfactory, Gustatory, And Vestibulocochlear Receptor Systems; Contain Sensory Cells Surrounded By Supportive, Non-Receptive Cells.
